264,657,CUSCO,ESPINAR,ESPINAR,,,,09.- CUSCO,OFICINA REGISTRAL AUXILIAR,ORA,ORA ESPINAR (MINSA),08:45 a 16:30,,Calle Domingo Huarca Cruz S/N Barrio Túpac Amaru  - Hospital Espinar,OPERATIVO,SI,NO,NO,SI,SI,SI,NO,NO,NO
265,713,MADRE DE DIOS,TAHUAMANU,IBERIA,,,,09.- CUSCO,OFICINA REGISTRAL AUXILIAR,ORA,ORA SAN MARTIN DE PORRES DE IBERIA (MINSA),08:45 a 16:30,,Calle Mocopata S/N,OPERATIVO,SI,NO,NO,SI,SI,SI,NO,NO,NO
266,349,APURIMAC,COTABAMBAS,TAMBOBAMBA,,,,09.- CUSCO,OFICINA REGISTRAL AUXILIAR,ORA,ORA TAMBOBAMBA (MINSA),08:45 a 16:30,, Hospital Tambobamba,OPERATIVO,SI,NO,NO,SI,SI,SI,NO,NO,NO
267,793,APURIMAC,COTABAMBAS,HAQUIRA,,,,09.- CUSCO,PUNTO DE ATENCION PERMANENTE,PAP,PAP HAQUIRA,08:45 a 16:45,, Plaza de armas S/N-Haquira,DESPLAZAMIENTO,SI,SI,SI,SI,SI,NO,SI,SI,SI
268,728,CUSCO,CHUMBIVILCAS,SANTO TOMAS,,,,09.- CUSCO,OFICINA REGISTRAL AUXILIAR,ORA,ORA SANTO TOMAS (MINSA),08:45 a 16:30,,Calle  Andres Avelino Caceres - Hospital Santo Tomas  ,DESPLAZAMIENTO,SI,NO,NO,SI,SI,SI,NO,NO,NO
269,920,CUSCO,CHUMBIVILCAS,VELILLE,,,,09.- CUSCO,PUNTO DE ATENCION NO PERMANENTE,PANP,PANP VELILLE,08:45 a 16:45,, Plaza de Armas - Municipalidad Distrital Velille,DESPLAZAMIENTO,NO,NO,SI,SI,SI,NO,SI,SI,NO
270,919,CUSCO,CALCA,YANATILE,,,,09.- CUSCO,PUNTO DE ATENCION NO PERMANENTE,PANP,PANP YANATILE,08:45 a 16:45,, Plaza de Armas - Municipalidad Distrital Yanatile,DESPLAZAMIENTO,NO,NO,SI,SI,SI,NO,SI,SI,NO
271,921,APURIMAC,ABANCAY,CURAHUASI,,,,09.- CUSCO,PUNTO DE ATENCION NO PERMANENTE,PANP,PANP CURAHUASI,08:45 a 16:45,, Coliseo Cerrado - Municipalidad de Curahuasi,DESPLAZAMIENTO,NO,NO,SI,SI,SI,NO,SI,SI,NO
272,1132,CUSCO,CUSCO,SANTIAGO,,,,09.- CUSCO,AGENCIA,AG,AGENCIA SANTIAGO,08:15 a 16:15,,Calle Giraldo Ruiz Caro S/N,OPERATIVO,SI,SI,SI,SI,SI,NO,NO,NO,SI
273,1165,CUSCO,CUSCO,WANCHAQ,,,,09.- CUSCO,MEJOR ATENCION AL CIUDADANO,MAC,MAC - CUSCO,08:30 a 16:30,,Avenida Collasuyo 2964 - Real Plaza Cusco,OPERATIVO,SI,SI,SI,SI,SI,NO,SI,SI,SI
274,343,MADRE DE DIOS,TAMBOPATA,INAMBARI,,,,09.- CUSCO,AGENCIA,AG,AG INAMBARI,08:45 a 16:45,, Plaza de Armas - Municipalidad Provincial de Inambari,DESPLAZAMIENTO,NO,NO,SI,SI,SI,NO,SI,SI,NO
275,600021,CUSCO,CUSCO,CUSCO,,,,09.- CUSCO,AGENTE RENIEC,AGENTE,AGENTE RENIEC - OR CUSCO,08:45 a 16:45,,Avenida El Sol N° 272,OPERATIVO,NO,NO,SI,NO,NO,NO,NO,NO,NO
276,600,CUSCO,CUSCO,SANTIAGO,,,,09.- CUSCO,OFICINA REGISTRAL AUXILIAR,ORA,ORA BELEMPAMPA (MINSA),08:45 a 13:00,,Plazoleta Belen S/N,OPERATIVO,SI,NO,NO,SI,SI,SI,NO,NO,NO
277,8,LIMA,LIMA ,JESUS MARIA,,,,10.- LIMA,OFICINA REGISTRAL AUXILIAR,ORA,ORA HOSPITAL NACIONAL EDGARDO REBAGLIATI MARTINS (ESSALUD),08:45 a 16:30,,Avenida SALAVERRY CDRA. 13 - PUERTA 6,OPERATIVO,SI,NO,NO,SI,NO,SI,NO,NO,NO
278,11,CALLAO,CALLAO,BELLAVISTA,,,,10.- LIMA,OFICINA REGISTRAL AUXILIAR,ORA,ORA NAC. DANIEL A. CARRIÓN (MINSA),08:45 a 16:30,,Avenida Guardia Chalaca Nº 2176 - Bellavista,OPERATIVO,SI,NO,NO,SI,NO,SI,NO,NO,NO
279,12,LIMA,LIMA,SAN JUAN DE LURIGANCHO,,,,10.- LIMA,OFICINA REGISTRAL AUXILIAR,ORA,ORA HOSPITAL SAN JUAN DE LURIGANCHO (MINSA),08:45 a 16:30,,Avenida Canto Grande S/N - Altura del paradero 10,OPERATIVO,SI,NO,NO,SI,NO,SI,NO,NO,NO
280,14,LIMA,LIMA,EL AGUSTINO,,,,10.- LIMA,OFICINA REGISTRAL AUXILIAR,ORA,ORA HOSPITAL NACIONAL HIPOLITO UNANUE (MINSA),08:45 a 16:30,,Avenida Cesar Vallejo Nº 1390 ,OPERATIVO,SI,NO,NO,SI,NO,SI,NO,NO,NO
281,51,LIMA,LIMA,LIMA,,,,10.- LIMA,OFICINA REGISTRAL AUXILIAR,ORA,ORA INSTITUTO NACIONAL MATERNO PERINATAL (MINSA),08:45 a 16:30,,Jirón Miroquesada Nº 941 - Lima,OPERATIVO,SI,SI,NO,SI,SI,SI,NO,NO,NO
282,58,CALLAO,CALLAO,VENTANILLA,,,,10.- LIMA,OFICINA REGISTRAL,OR,OR VENTANILLA,08:45 a 16:45,,Avenida Pachacutec N° 225 - Sector B - Grupo Residencial B1 - Mz. F1 ,OPERATIVO,SI,SI,SI,SI,SI,SI,SI,SI,SI
283,168,LIMA,LIMA,SAN BORJA,,,,10.- LIMA,OFICINA REGISTRAL,OR,OR SAN BORJA,08:45 a 16:45,,Avenida San Luis N° 1673 Urb. Jacaranda II,OPERATIVO,SI,SI,SI,SI,SI,SI,SI,SI,SI
284,174,LIMA,LIMA,LIMA,,,,10.- LIMA,OFICINA REGISTRAL,OR,OR QUILCA,08:45 a 16:45,,Jirón Quilca Nº 501 y 525 ,OPERATIVO,SI,SI,SI,SI,SI,SI,SI,SI,SI
285,175,LIMA,LIMA,LIMA,,,,10.- LIMA,AGENCIA,OR,OR ANCASH,08:45 a 16:45,,Jirón Ancash Nº 336-340 y 344 (Frente a la Plazuela San Francisco) - Lima,OPERATIVO,SI,SI,SI,SI,SI,NO,SI,SI,SI
286,187,LIMA,LIMA,VILLA MARÍA DEL TRIUNFO,,,,10.- LIMA,OFICINA REGISTRAL AUXILIAR,ORA,ORA DANIEL ALCIDES CARRION (MINSA),08:45 a 16:30,,Avenida Pachacutec N° 3470 - Pasando el Terminal Pesquero.,OPERATIVO,SI,NO,NO,SI,NO,SI,NO,NO,NO
287,335,CALLAO,CALLAO,BELLAVISTA,,,,10.- LIMA,MEJOR ATENCION AL CIUDADANO,MAC,MAC - CALLAO,"L - V  08:30 a 18:00 
SAB.8:30 a 13:00",,Avenida Oscar R. Benavides N° 3866 - Centro Comercial Mall Aventura Plaza,OPERATIVO,SI,SI,SI,SI,SI,NO,SI,SI,SI
288,371,LIMA,LIMA,LIMA,,,,10.- LIMA,OFICINA REGISTRAL,OR,OR LIMA,08:45 a 16:45,,Jirón Nicolás de Piérola N 545,OPERATIVO,SI,SI,SI,SI,SI,SI,SI,SI,SI
289,372,LIMA,LIMA,ATE,,,,10.- LIMA,OFICINA REGISTRAL ,OR,OR ATE - Complejo Deportivo Ollantaytambo,08:45 a 16:45,,Av. Alfonso Ugarte s/n  Complejo Deportivo Ollantaytambo,OPERATIVO,SI,NO,SI,SI,NO,NO,NO,NO,SI
290,372,LIMA,LIMA,ATE,,,,10.- LIMA,OFICINA REGISTRAL,OR,OR ATE - Mac Express de Puruchuco,"08:45 a 13:00 
 14:00 a 16:45 ",,Av. Javier Pardo Este N° 8680  Mac Express - Agencia Municipal Real Plaza de Puruchuco.,OPERATIVO,NO,SI,NO,NO,SI,SI,SI,SI,SI
291,379,LIMA,LIMA,LURIN,,,,10.- LIMA,OFICINA REGISTRAL,OR,OR LURIN,08:45 a 16:45,,"MZ B, Lote 5 Asociación de Vivienda Familiar Centinela - Lurin",OPERATIVO,SI,SI,SI,SI,SI,SI,SI,SI,SI
292,380,LIMA,LIMA,MIRAFLORES,,,,10.- LIMA,OFICINA REGISTRAL,OR,OR MIRAFLORES,08:45 a 16:45,,Avenida Ernesto Diez Canseco N° 230,OPERATIVO,SI,SI,SI,SI,SI,SI,SI,SI,SI
293,382,LIMA,LIMA,PUENTE PIEDRA,,,,10.- LIMA,OFICINA REGISTRAL,OR,OR PUENTE PIEDRA,08:45 a 16:45,,Jirón Ricardo Palma Nº 241,OPERATIVO,SI,SI,SI,SI,SI,SI,SI,SI,SI
294,386,LIMA,LIMA,SAN JUAN DE LURIGANCHO,,,,10.- LIMA,OFICINA REGISTRAL,OR,OR SAN JUAN DE LURIGANCHO,08:45 a 16:45,,Avenida Las Flores Lote 1 Mz. G Urb. Canto Grande Unidad 7,OPERATIVO,SI,SI,SI,SI,SI,SI,SI,SI,SI
295,387,LIMA,LIMA,SAN JUAN DE MIRAFLORES,,,,10.- LIMA,OFICINA REGISTRAL,OR,OR SAN JUAN DE MIRAFLORES,08:45 a 16:45,,Avenida Guillermo Billinghurst  N° 767 – 769 Mz. F Lote 18 Urb. SJM Parcela D,OPERATIVO,SI,SI,SI,SI,SI,SI,SI,SI,SI
296,389,LIMA,LIMA,SAN MARTIN DE PORRES,,,,10.- LIMA,OFICINA REGISTRAL,OR,OR SAN MARTIN DE PORRES,08:45 a 16:45,,Avenida Eduardo de Habich Nº 590 - 592 con Pedro Paulet N° 589,OPERATIVO,SI,SI,SI,SI,SI,SI,SI,SI,SI
297,391,LIMA,CAJATAMBO,CAJATAMBO,,,,10.- LIMA,AGENCIA,AG,AG CAJATAMBO,08:45 a 16:45,,Jirón Bolognesi S/N - Comisiones de Regantes -Frente plaza de Armas,OPERATIVO,SI,SI,SI,SI,SI,NO,SI,SI,SI
298,392,LIMA,CANTA,CANTA,,,,10.- LIMA,AGENCIA,AG,AG CANTA,08:45 a 16:45,,Jirón Independencia Nº 308 Municipio (Plaza de Armas),OPERATIVO,SI,SI,SI,SI,SI,NO,SI,SI,SI
299,393,LIMA,CAÑETE,SAN VICENTE DE CAÑETE,,,,10.- LIMA,AGENCIA,AG,AG CAÑETE,08:45 a 16:45,,Avenida Los Libertadores Mz. D-3 Lote 4 Urbanización Tercer Mundo,OPERATIVO,SI,SI,SI,SI,SI,NO,SI,SI,SI
300,394,LIMA,HUAURA,HUACHO,,,,10.- LIMA,AGENCIA,AG,AG HUACHO,08:45 a 16:45,,Avenida Grau Nº 295,OPERATIVO,SI,SI,SI,SI,SI,NO,SI,SI,SI
301,395,LIMA,HUAROCHIRI,MATUCANA,,,,10.- LIMA,AGENCIA,AG,AG MATUCANA,08:45 a 16:45,,Jirón Tacna 626  - Centro Civico,OPERATIVO,SI,SI,SI,SI,SI,NO,SI,SI,SI
302,396,LIMA,YAUYOS,YAUYOS,,,,10.- LIMA,AGENCIA,AG,AG YAUYOS,08:45 a 16:45,,Plaza Plaza Constitución Nº 110,OPERATIVO,SI,SI,SI,SI,SI,NO,SI,SI,SI
303,397,LIMA,HUARAL,HUARAL,,,,10.- LIMA,AGENCIA,AG,AG HUARAL,08:45 a 16:45,,Pasaje el Palmo esquina con Calle Huaquilla (DEMUNA HUARAL),OPERATIVO,SI,SI,SI,SI,SI,NO,SI,SI,SI
304,398,LIMA,BARRANCA,BARRANCA,,,,10.- LIMA,OFICINA REGISTRAL,OR,OR BARRANCA,08:45 a 16:45,,Avenida Independencia N° 674 - 676 - 678,OPERATIVO,SI,SI,SI,SI,SI,SI,SI,SI,SI
305,399,LIMA,OYON,OYON,,,,10.- LIMA,AGENCIA,AG,AG OYON,08:45 a 16:45,,Jirón Unión 216,OPERATIVO,SI,SI,SI,SI,SI,NO,SI,SI,SI
306,401,LIMA,LIMA,LURIGANCHO,,,,10.- LIMA,OFICINA REGISTRAL,OR,OR CHOSICA,08:45 a 16:45,,Jirón Chucuito Nº 248 ,OPERATIVO,SI,SI,SI,SI,SI,SI,SI,SI,SI
307,405,LIMA,LIMA,JESUS MARIA,,,,10.- LIMA,OFICINA REGISTRAL,OR,OR JESUS MARIA,08:45 a 16:45,,Jirón Talara N° 130-132-134 y 136 Jesús Maria,OPERATIVO,SI,SI,SI,SI,SI,SI,SI,SI,SI
308,421,LIMA,LIMA,CIENEGUILLA,,,,10.- LIMA,OFICINA REGISTRAL,OR,OR CIENEGUILLA,08:45 a 16:45,,"Avenida San Martin Lote 15, Zona ""D"" Manzana ""D"" Centro Poblado Tambo Viejo",OPERATIVO,SI,SI,SI,SI,SI,SI,SI,SI,SI
309,423,LIMA,LIMA,SANTA ANITA,,,,10.- LIMA,OFICINA REGISTRAL,OR,OR SANTA ANITA,08:45 a 16:45,,"Avenida Los Eucaliptos Nº 947, Urbanización Universal",OPERATIVO,SI,SI,SI,SI,SI,SI,SI,SI,SI
310,430,LIMA,LIMA,INDEPENDENCIA,,,,10.- LIMA,OFICINA REGISTRAL,OR,OR INDEPENDENCIA,08:45 a 16:45,,Calle Los Andes Nº 486 Urb. Industrial Panamericana Norte,OPERATIVO,SI,SI,SI,SI,SI,SI,SI,SI,SI
311,544,CALLAO,CALLAO,VENTANILLA,,,,10.- LIMA,MEJOR ATENCION AL CIUDADANO,MAC,MAC - VENTANILLA,"L - V  08:30 a 18:00 
SAB.8:30 a 13:00",,Avenida La Playa S/N altura la Urb. Zona Comercial frente a la Plaza Cívica ,OPERATIVO,SI,SI,SI,SI,SI,NO,SI,SI,SI
312,550,LIMA,LIMA,JESUS MARIA,,,,10.- LIMA,AGENCIA,AG,AG 06 DE AGOSTO,08:45 a 16:45,,Avenida 06 de Agosto N° 856,OPERATIVO,NO,SI,NO,NO,SI,NO,SI,SI,SI
313,577,LIMA,LIMA,SAN MARTIN DE PORRES,,,,10.- LIMA,OFICINA REGISTRAL AUXILIAR,ORA,ORA NACIONAL CAYETANO HEREDIA (MINSA),08:45 a 16:30,,Jirón Honorio Delgado N° 262 - Urb. Ingeniería / Obstetricia,OPERATIVO,SI,NO,NO,SI,NO,SI,NO,NO,NO
314,640,LIMA,HUAURA,HUACHO,,,,10.- LIMA,OFICINA REGISTRAL AUXILIAR,ORA,ORA HOSPITAL GENERAL DE HUACHO (MINSA),08:45 a 16:30,,Avenida Jose Arnaldo Arambulo La Rosa N° 251,OPERATIVO,SI,SI,NO,SI,SI,SI,NO,NO,NO
315,706,LIMA,LIMA,VILLA EL SALVADOR,,,,10.- LIMA,OFICINA REGISTRAL,OR,OR VILLA EL SALVADOR,08:45 a 16:45,,"Av. Pastor Sevilla, Sector 6,Grupo 3A, Mz. B, Lote 24",OPERATIVO,SI,SI,SI,SI,SI,NO,NO,NO,SI
316,661,CALLAO,CALLAO,CALLAO,,,,10.- LIMA,OFICINA REGISTRAL,OR,OR CALLAO,08:45 a 16:45,,Avenida Dos de Mayo N° 440 - 446,OPERATIVO,SI,SI,SI,SI,SI,SI,SI,SI,SI
317,717,LIMA,LIMA,EL AGUSTINO,,,,10.- LIMA,MEJOR ATENCION AL CIUDADANO,MAC,MAC - LIMA ESTE,"L - V  08:30 a 18:00 
SAB.8:30 a 13:00",,Avenida Carretera Central 111 Mall Aventura Santa Anita Nivel 2,OPERATIVO,SI,SI,SI,SI,SI,NO,SI,SI,SI
318,729,CALLAO,CALLAO,CARMEN DE LA LEGUA REYNOSO,,,,10.- LIMA,OFICINA REGISTRAL AUXILIAR,ORA,ORA HOSPITAL SAN JOSE (MINSA),08:45 a 16:30,,Jirón Las Magnolias 475 Carmen de la Legua-Reynoso,OPERATIVO,SI,SI,NO,SI,SI,SI,NO,NO,NO
319,730,CALLAO,CALLAO,VENTANILLA,,,,10.- LIMA,OFICINA REGISTRAL AUXILIAR,ORA,ORA HOSPITAL DE VENTANILLA (MINSA),08:45 a 16:30,,Avenida Pedro Beltran S/N Ventanilla - Hospital de Ventanilla,OPERATIVO,SI,SI,NO,SI,SI,SI,NO,NO,NO
320,739,LIMA,CAÑETE,SAN LUIS,,,,10.- LIMA,OFICINA REGISTRAL AUXILIAR,ORA,ORA HOSPITAL REZOLA (MINSA),08:45 a 16:30,,Calle Distrito de San Luis S/N,OPERATIVO,SI,SI,NO,SI,SI,SI,NO,NO,NO
321,740,LIMA,BARRANCA,BARRANCA,,,,10.- LIMA,OFICINA REGISTRAL AUXILIAR,ORA,ORA HOSPITAL DE BARRANCA (MINSA),08:45 a 16:30,,Avenida Nicolás de Piérola Nº 210 -224,OPERATIVO,SI,SI,NO,SI,SI,SI,NO,NO,NO
322,753,LIMA,HUARAL,HUARAL,,,,10.- LIMA,OFICINA REGISTRAL AUXILIAR,ORA,ORA HOSPITAL SAN JUAN BAUTISTA HUARAL (MINSA),08:45 a 16:30,,Calle Tacna Nº 120 Urb. San Juan I,OPERATIVO,SI,SI,NO,SI,SI,SI,NO,NO,NO
323,754,LIMA,LIMA ,COMAS,,,,10.- LIMA,OFICINA REGISTRAL AUXILIAR,ORA,ORA HOSPITAL NACIONAL SERGIO E. BERNALES (MINSA),08:45 a 16:30,,"Avenida Túpac Amaru N° 8000, Collique, Comas.",OPERATIVO,SI,SI,NO,SI,SI,SI,NO,NO,NO
324,755,LIMA,LIMA,LIMA,,,,10.- LIMA,OFICINA REGISTRAL AUXILIAR,ORA,ORA NACIONAL DOS DE MAYO (MINSA),08:45 a 16:30,,Avenida Parque Historia De La Medicina Peruana S/N Altura Cuadra 13 Av Grau,OPERATIVO,SI,SI,NO,SI,SI,SI,NO,NO,NO
325,757,LIMA,LIMA,ATE ,,,,10.- LIMA,OFICINA REGISTRAL AUXILIAR,ORA,ORA HOSPITAL DE HUAYCAN (MINSA),08:45 a 16:30,,Avenida José C.Mariátegui S/N Zona B - A.H.Huaycán S/N Ate Lima Lima,OPERATIVO,SI,SI,NO,SI,SI,SI,NO,NO,NO
326,796,LIMA,LIMA,SAN JUAN DE MIRAFLORES,,,,10.- LIMA,MEJOR ATENCION AL CIUDADANO,MAC,MAC - LIMA SUR,"L - V  08:30 a 18:00 
SAB.8:30 a 13:00",,Avenida Circunvalación 1583- San Juan de Miraflores,OPERATIVO,SI,SI,SI,SI,SI,NO,SI,SI,SI
327,808,LIMA,LIMA,COMAS,,,,10.- LIMA,MEJOR ATENCION AL CIUDADANO,MAC,MAC - LIMA NORTE,"L - V  08:30 a 18:00 
SAB.8:30 a 13:00",,Avenida Los Angeles N° 602 2do piso - Cc Mall Plaza ,OPERATIVO,SI,SI,SI,SI,SI,NO,SI,SI,SI
328,600013,LIMA,LIMA,JESUS MARIA,,,,10.- LIMA,AGENTE RENIEC,AGENTE,AGENTE RENIEC - OR JESUS MARIA ( 3.0),08:45 a 16:45,,Jirón Talara N° 130,OPERATIVO,NO,NO,NO,NO,NO,NO,SI,NO,NO
329,600011,LIMA,LIMA,MIRAFLORES,,,,10.- LIMA,AGENTE RENIEC,AGENTE,AGENTE RENIEC - OR MIRAFLORES ( 3.0),08:45 a 16:45,,Avenida Diez Canseco N° 230,OPERATIVO,NO,NO,NO,NO,NO,NO,SI,NO,NO
330,600023,LIMA,LIMA,INDEPENDENCIA,,,,10.- LIMA,AGENTE RENIEC,AGENTE,AGENTE RENIEC - OR INDEPENDENCIA (3.0),08:45 a 16:45,,Calle Los Andes Nº 486 Urb. Industrial Panamericana Norte,OPERATIVO,NO,NO,NO,NO,NO,NO,SI,NO,NO
331,17,LIMA,LIMA,SANTA ANITA,,,,10.- LIMA,OFICINA REGISTRAL AUXILIAR,ORA,ORA HOSP. JORGE VOTO BERNALES (ESSALUD),08:45 a 16:30,,"Carretera CARRETERA CENTRAL KM. 3,5 - SANTA ANITA",OPERATIVO,SI,NO,NO,SI,NO,SI,NO,NO,NO
332,186,LIMA,LIMA,LIMA,,,,10.- LIMA,OFICINA REGISTRAL AUXILIAR,ORA,HOSP. NAC DOC MADRE Y NIÑO  SAN BARTOLOME (MINSA),08:45 a 16:30,,Avenida ALFONSO UGARTE 825 - LIMA,OPERATIVO,SI,NO,NO,SI,NO,SI,NO,NO,NO
333,13,LIMA,LIMA,PUENTE PIEDRA,,,,10.- LIMA,OFICINA REGISTRAL AUXILIAR,ORA,ORA HOSPITAL PUENTE PIEDRA (MINSA),08:45 a 16:30,,Avenida SAENZ PEÑA S/N KM 30,OPERATIVO,SI,NO,NO,SI,NO,SI,NO,NO,NO
334,1183,LIMA,HUARAL,CHANCAY,,,,10.- LIMA,AGENCIA,AG,AG CHANCAY,08:45 a 16:45,,Avenida 1ro de mayo s/n cdra 03,OPERATIVO,SI,SI,SI,SI,SI,NO,SI,SI,SI
335,9,LIMA,LIMA,PUEBLO LIBRE,,,,10.- LIMA,OFICINA REGISTRAL AUXILIAR,ORA,ORA HOSPITAL SANTA ROSA,08:45 a 16:30,,Avenida Bolivar Crda. 8 Pueblo Libre ,OPERATIVO,SI,NO,NO,SI,NO,SI,NO,NO,NO
336,769,LIMA,LIMA,INDEPENDENCIA,,,,10.- LIMA,OFICINA REGISTRAL AUXILIAR,ORA,ORA  CMI TAHUANTINSUYO BAJO,08:45 a 16:30,,Avenida Chinchaysullo cdra 4 Independencia,OPERATIVO,SI,SI,NO,SI,SI,SI,NO,NO,NO
337,114,LIMA,LIMA,SURQUILLO,,,,10.- LIMA,AGENCIA,AG,AG. INSTITUTO NACIONAL DE ENFERMEDADES NEOPLASICAS,08:45 a 16:45,,Av. Angamos Este 2520 - Surquillo (puerta emergencia del INEN),OPERATIVO,SI,NO,SI,SI,NO,NO,NO,NO,NO
338,491,LIMA,LIMA,SAN MARTIN DE PORRES,,,,10.- LIMA,AGENTE RENIEC,AGENTE,AGENTE RENIEC - OR SAN MARTIN DE PORRES (3.0),08:45 a 16:45,,Av. Eduardo de Habich 592,OPERATIVO,NO,NO,NO,NO,NO,NO,SI,NO,NO
339,600003,LIMA,LIMA,SAN JUAN DE MIRAFLORES,,,,10.- LIMA,AGENTE RENIEC,AGENTE,AGENTE RENIEC - MALL  DEL SUR (3.0),08:45 a 16:45,,"Av. Los Lirios s/n, altura de  puente Atocongo",OPERATIVO,NO,NO,NO,NO,NO,NO,SI,NO,NO
340,600012,LIMA,LIMA,SAN BORJA,,,,10.- LIMA,AGENTE RENIEC,AGENTE,AGENTE RENIEC - OR SAN BORJA (3.0),08:45 a 16:45,,Av. San Luis N° 1673 Urb. Jacaranda II,OPERATIVO,NO,NO,NO,NO,NO,NO,SI,NO,NO
341,600002,LIMA,LIMA,LIMA,,,,10.- LIMA,AGENTE RENIEC,AGENTE,AGENTE RENIEC - OR LIMA (3.0),08:45 a 16:45,,Av. Nicolas de Pierola 545,OPERATIVO,NO,NO,NO,NO,NO,NO,SI,NO,NO
342,600005,LIMA,LIMA,LIMA,,,,10.- LIMA,AGENTE RENIEC,AGENTE,AGENTE RENIEC - AGENCIA ANCASH (3.0),08:45 a 16:45,,Jr. Ancash 336-340 Cercado,OPERATIVO,NO,NO,NO,NO,NO,NO,SI,NO,NO
343,600009,LIMA,BARRANCA,BARRANCA,,,,10.- LIMA,AGENTE RENIEC,AGENTE,AGENTE RENIEC - OR BARRANCA (3.0),08:45 a 16:45,,Av. Prolongacion Independencia 250,OPERATIVO,NO,NO,NO,NO,NO,NO,SI,NO,NO
344,50,LIMA,LIMA,LIMA,,,,10.- LIMA,OFICINA REGISTRAL AUXILIAR,ORA,ORA HOSPITAL NACIONAL ARZOBISPO LOAYZA,08:45 a 16:30,,Av. Alfonso Ugarte N° 848,OPERATIVO,SI,NO,NO,SI,NO,SI,NO,NO,NO
345,758,LIMA,LIMA,VILLA EL SALVADOR,,,,10.- LIMA,OFICINA REGISTRAL AUXILIAR,ORA,ORA HOSPITAL EMERGENCIA VILLA EL SALVADOR,08:45 a 16:30,,Avenida  Pastor Sevilla cruce Av. 200 millas VES,OPERATIVO,SI,SI,NO,SI,SI,SI,NO,NO,NO
346,600027,LIMA,LIMA,SANTIAGO DE SURCO,,,,10.- LIMA,AGENTE RENIEC,AGENTE,AGENTE RENIEC - JOCKEY PLAZA ( 3.0),08:45 a 16:45,,Av. Javier Prado Este 4200 (Centro Financiero del Centro Comercial),OPERATIVO,NO,NO,NO,NO,NO,NO,SI,NO,NO
347,600028,LIMA,LIMA,SURQUILLO,,,,10.- LIMA,AGENTE RENIEC,AGENTE,AGENTE RENIEC - OPEN PLAZA ( 3.0),08:45 a 16:45,,Av. Angamos N° 1805 cruce con Av. Tomas Marsano),OPERATIVO,NO,NO,NO,NO,NO,NO,SI,NO,NO
348,19,PUNO,PUNO,PUNO,,,,11.- PUNO,OFICINA REGISTRAL AUXILIAR,ORA,ORA MANUEL NUÑEZ BUTRON,08:45 a 16:45,,El Sol N° 1022,OPERATIVO,SI,SI,NO,SI,SI,SI,NO,NO,NO
349,89,PUNO,PUNO,PUNO,,,,11.- PUNO,OFICINA REGISTRAL AUXILIAR,ORA,ORA HOSPITAL BASE III (PUNO) - RED ASISTENCIAL PUNO,08:45 a 16:45,,Francisco Cáceres Jara Nº 600,OPERATIVO,SI,SI,NO,SI,SI,SI,NO,NO,NO
350,90,PUNO,SAN ROMAN,JULIACA,,,,11.- PUNO,OFICINA REGISTRAL AUXILIAR,ORA,ORA CARLOS MONGE MEDRANO,08:45 a 16:45,,Carretera a Huancane Km 2,OPERATIVO,SI,SI,NO,SI,SI,SI,NO,NO,NO
351,108,PUNO,EL COLLAO ,ILAVE ,,,,11.- PUNO,OFICINA REGISTRAL AUXILIAR,ORA,ORA ILAVE,08:45 a 16:45,,Atahualpa Nº 825,OPERATIVO,SI,SI,NO,SI,SI,SI,NO,NO,NO
352,118,PUNO,SAN ROMAN,JULIACA,,,,11.- PUNO,OFICINA REGISTRAL AUXILIAR,ORA,ORA HOSPITAL BASE III JULIACA - ESSALUD - RED ASISTENCIAL JULIACA,08:45 a 16:45,,José Santos Chocano S/N - La Capilla,OPERATIVO,SI,SI,NO,SI,SI,SI,NO,NO,NO
353,551,PUNO,PUNO,PUNO,,,,11.- PUNO,OFICINA REGISTRAL,OR,OR PUNO,08:45 a 16:45,,Arequipa N° 1143 - 1145 Barrio Victoria,OPERATIVO,SI,SI,SI,SI,SI,SI,SI,SI,SI
354,552,PUNO,AZANGARO,AZANGARO,,,,11.- PUNO,PUNTO DE ATENCION PERMANENTE,PAP,PAP AZANGARO,08:45 a 16:45,,Azangaro N° 160  (Palacio Municipal),OPERATIVO,SI,SI,SI,SI,SI,NO,SI,SI,NO
355,553,PUNO,CARABAYA,MACUSANI,,,,11.- PUNO,PUNTO DE ATENCION PERMANENTE,PAP,PAP CARABAYA,08:45 a 16:45,,Raimondi N° 116,OPERATIVO,NO,SI,SI,SI,SI,NO,SI,SI,NO
356,554,PUNO,CHUCUITO,JULI,,,,11.- PUNO,PUNTO DE ATENCION PERMANENTE,PAP,PAP CHUCUITO,08:45 a 16:45,,Ilave 235 - Mercado Central Municipio,OPERATIVO,NO,SI,SI,SI,SI,NO,SI,SI,NO
357,555,PUNO,HUANCANE,HUANCANE,,,,11.- PUNO,PUNTO DE ATENCION PERMANENTE,PAP,PAP HUANCANE,08:45 a 16:45,,Moquegua N° 104 - Barrio Progreso,OPERATIVO,NO,SI,SI,SI,SI,NO,SI,SI,NO
358,556,PUNO,LAMPA,LAMPA,,,,11.- PUNO,PUNTO DE ATENCION PERMANENTE,PAP,PAP LAMPA,08:45 a 16:45,,Alfonso Ugarte N° 343,OPERATIVO,NO,SI,SI,SI,SI,NO,SI,SI,NO
359,557,PUNO,MELGAR,AYAVIRI,,,,11.- PUNO,PUNTO DE ATENCION PERMANENTE,PAP,PAP MELGAR,08:45 a 16:45,,Jorge Chavez N°  550,OPERATIVO,SI,SI,SI,SI,SI,NO,SI,SI,NO
360,558,PUNO,SANDIA,SANDIA,,,,11.- PUNO,PUNTO DE ATENCION PERMANENTE,PAP,PAP SANDIA,08:45 a 16:45,,Juliaca S/N - Mercado Central Sandia,OPERATIVO,NO,SI,SI,SI,SI,NO,SI,SI,NO
361,559,PUNO,SAN ROMAN,JULIACA,,,,11.- PUNO,AGENCIA,AG,AG SAN ROMAN,08:45 a 16:45,,Brascesco N° 181 ,OPERATIVO,SI,SI,SI,SI,SI,NO,SI,SI,SI
362,560,PUNO,YUNGUYO,YUNGUYO,,,,11.- PUNO,PUNTO DE ATENCION PERMANENTE,PAP,PAP YUNGUYO,08:45 a 16:45,,Grau Nº 240,OPERATIVO,NO,SI,SI,SI,SI,NO,SI,SI,NO
363,561,PUNO,SAN ANTONIO DE PUTINA,PUTINA,,,,11.- PUNO,PUNTO DE ATENCION PERMANENTE,PAP,PAP PUTINA,08:45 a 16:45,,Plaza de Armas S/N (Palacio Municipal),OPERATIVO,NO,SI,SI,SI,SI,NO,SI,SI,NO
364,562,PUNO,EL COLLAO,ILAVE,,,,11.- PUNO,PUNTO DE ATENCION PERMANENTE,PAP,PAP EL COLLAO,08:45 a 16:45,,Bolognesi S/N - Coliseo Cubierto Ilave Oficina N° 02,OPERATIVO,SI,SI,SI,SI,SI,NO,SI,SI,NO
365,563,PUNO,MOHO,MOHO,,,,11.- PUNO,PUNTO DE ATENCION PERMANENTE,PAP,PAP MOHO,08:45 a 16:45,,Circunvalación S/N Terminal Terrestre,DESPLAZAMIENTO,NO,SI,SI,SI,SI,NO,NO,NO,NO
366,634,PUNO,AZANGARO,AZANGARO,,,,11.- PUNO,OFICINA REGISTRAL AUXILIAR,ORA,ORA CARLOS CORNEJO ROSELLO,08:45 a 16:45,,Francisco Bolognesi N° 557,OPERATIVO,SI,SI,NO,SI,SI,SI,NO,NO,NO
367,635,PUNO,CHUCUITO,JULI,,,,11.- PUNO,OFICINA REGISTRAL AUXILIAR,ORA,ORA JULI,08:45 a 16:45,,Panamericana S/N,OPERATIVO,SI,SI,NO,SI,SI,SI,NO,NO,NO
368,636,PUNO,HUANCANE,HUANCANE,,,,11.- PUNO,OFICINA REGISTRAL AUXILIAR,ORA,ORA HOSPITAL LUCIO ALDAZABAL PAUCA,08:45 a 16:45,,Santa Cruz S/N,OPERATIVO,SI,SI,NO,SI,SI,SI,NO,NO,NO
369,637,PUNO,MELGAR,AYAVIRI,,,,11.- PUNO,OFICINA REGISTRAL AUXILIAR,ORA,ORA SAN JUAN DE DIOS (AYAVIRI),08:45 a 16:45,,Progreso S/N,OPERATIVO,SI,SI,NO,SI,SI,SI,NO,NO,NO
370,759,PUNO,SAN ROMAN,JULIACA,,,,11.- PUNO,OFICINA REGISTRAL AUXILIAR,ORA,ORA CENTRO DE SALUD CLAS SANTA ADRIANA,08:45 a 16:45,,Pachacutec S/N,OPERATIVO,SI,SI,NO,SI,SI,SI,NO,NO,NO
371,792,PUNO,SAN ROMAN,SAN MIGUEL,,,,11.- PUNO,PUNTO DE ATENCION PERMANENTE,PAP,PAP SAN MIGUEL - JR11,08:45 a 16:45,,Palacio Municipal S/N,OPERATIVO,SI,SI,SI,SI,SI,NO,SI,SI,NO
372,791,PUNO,CHUCUITO,DESAGUADERO,,,,11.- PUNO,PUNTO DE ATENCION PERMANENTE,PAP,PAP DESAGUADERO,08:45 a 16:45,,28 de Julio N° 305 - Desaguadero,OPERATIVO,NO,SI,SI,SI,SI,NO,NO,NO,NO
373,824,PUNO,PUNO,ACORA,,,,11.- PUNO,PUNTO DE ATENCION PERMANENTE,PAP,PAP ACORA,08:45 a 16:45,,Plaza de Armas (Palacio Municipal),OPERATIVO,NO,SI,SI,SI,SI,NO,NO,NO,NO
374,1184,PUNO,SAN ROMAN,JULIACA,,,,11.- PUNO,CENTRO DE MEJOR ATENCION AL CIUDADANO,MAC,MAC PUNO,08:45 a 16:45,,San Martin lote 07,OPERATIVO,SI,SI,SI,SI,SI,NO,SI,SI,SI
375,1185,PUNO,CARABAYA,CRUCERO,,,,11.- PUNO,PUNTO DE ATENCION NO PERMANENTE,PANP,PANP CRUCERO,08:45 a 16:45,,Plaza de Armas S/N,DESPLAZAMIENTO,NO,SI,SI,SI,SI,NO,SI,SI,NO
376,18,ICA,ICA,ICA,,,,12.- ICA,OFICINA REGISTRAL AUXILIAR,ORA,ORA REGIONAL DE ICA (MINSA),08:45 a 16:30,,Avenida Huacachina S/N,OPERATIVO,SI,SI,NO,SI,SI,SI,NO,NO,NO
377,125,AYACUCHO,LUCANAS,PUQUIO,,,,12.- ICA,AGENCIA,AG,AG LUCANAS,08:45 a 16:45,,Jirón San Pedro  Nº 216,OPERATIVO,SI,SI,SI,SI,SI,NO,SI,SI,SI
378,126,AYACUCHO,PARINACOCHAS,CORACORA,,,,12.- ICA,AGENCIA,AG,AG PARINACOCHAS,08:45 a 16:45,,Jirón Bolognesi N° 419 Plaza de Armas,OPERATIVO,SI,NO,SI,SI,SI,NO,SI,SI,NO
379,150,ICA,ICA,PARCONA,,,,12.- ICA,PUNTO DE ATENCION PERMANENTE,PAP,PAP PARCONA,08:45 a 16:45,,Avenida Jhon F. Kennedy N° 500 con Calle Lima S/N (Costado del Palacio Municipal),OPERATIVO,SI,SI,SI,SI,SI,NO,SI,SI,SI
380,271,ICA,ICA,ICA,,,,12.- ICA,OFICINA REGISTRAL,OR,OR ICA,08:45 a 16:45,,Avenida San Martin N° 1366 Mz. M-02 Lt. 035. Urb. San Isidro ,OPERATIVO,SI,SI,SI,SI,SI,NO,SI,SI,SI
381,272,ICA,CHINCHA,CHINCHA ALTA,,,,12.- ICA,AGENCIA,AG,AG CHINCHA,08:45 a 16:45,,Calle Los Angeles N° 300,OPERATIVO,SI,SI,SI,SI,SI,NO,SI,SI,SI
382,273,ICA,NASCA,NASCA,,,,12.- ICA,AGENCIA,AG,AG NASCA,08:45 a 16:45,,Calle Fermin del Castillo N° 270,OPERATIVO,SI,SI,SI,SI,SI,NO,SI,SI,SI
383,274,ICA,PISCO,PISCO,,,,12.- ICA,AGENCIA,AG,AG PISCO,08:45 a 16:45,,Calle San Juan de Dios N° 288,OPERATIVO,SI,SI,SI,SI,SI,NO,SI,SI,SI
384,275,ICA,PALPA,PALPA,,,,12.- ICA,AGENCIA,AG,AG PALPA,08:45 a 16:45,,Calle Portal de Escribanos Nº 145,OPERATIVO,SI,NO,SI,SI,SI,NO,SI,SI,NO
385,330,AYACUCHO,LUCANAS,CABANA,,,,12.- ICA,PUNTO DE ATENCION NO PERMANENTE,PAP,PAP CABANA ,08:45 a 16:45,,Jirón Jorge Chavez N° 272 ,DESPLAZAMIENTO,NO,NO,SI,SI,SI,NO,SI,SI,NO
386,346,AYACUCHO,LUCANAS,PUQUIO,,,,12.- ICA,OFICINA REGISTRAL AUXILIAR,ORA,ORA FELIPE HUAMAN POMA DE AYALA (MINSA),08:45 a 16:30,,Avenida Arnaldo Alvarado S/N ,OPERATIVO,SI,SI,NO,SI,SI,SI,NO,NO,NO
387,347,AYACUCHO,PARINACOCHAS,CORACORA,,,,12.- ICA,OFICINA REGISTRAL AUXILIAR,ORA,ORA HOSPITAL DE APOYO DE CORACORA (MINSA),08:45 a 16:30,,Avenida La Cultura S/N,OPERATIVO,SI,SI,NO,SI,SI,SI,NO,NO,NO
388,354,ICA,ICA,ICA,,,,12.- ICA,OFICINA REGISTRAL AUXILIAR,ORA,ORA SANTA MARIA DEL SOCORRO (MINSA),08:45 a 16:30,,Calle Castrovirreyna N° 759,OPERATIVO,SI,SI,NO,SI,SI,SI,NO,NO,NO
389,355,ICA,PISCO,PISCO,,,,12.- ICA,OFICINA REGISTRAL AUXILIAR,ORA,ORA SAN JUAN DE DIOS (MINSA),08:45 a 16:30,,Avenida Fermín Tanguis S/N (Altura del Fundo Alto de la Luna),OPERATIVO,SI,SI,NO,SI,SI,SI,NO,NO,NO
390,356,ICA,CHINCHA,CHINCHA ALTA,,,,12.- ICA,OFICINA REGISTRAL AUXILIAR,ORA,ORA SAN JOSE DE CHINCHA (MINSA),08:45 a 16:30,,Avenida Abelardo Alva Maurtua Nº 600,OPERATIVO,SI,SI,NO,SI,SI,SI,NO,NO,NO
391,469,AYACUCHO,LUCANAS,LARAMATE,,,,12.- ICA,PUNTO DE ATENCION NO PERMANENTE,PANP,PANP LARAMATE,08:45 a 16:45,,Jirón Ica S/N,DESPLAZAMIENTO,NO,NO,SI,SI,SI,NO,NO,NO,NO
392,507,ICA,NASCA,NASCA,,,,12.- ICA,OFICINA REGISTRAL AUXILIAR,ORA,ORA HOSPITAL DE APOYO DE NASCA (MINSA),08:45 a 16:30,,Calle Callao S/N - 5ta Cuadra,OPERATIVO,SI,SI,NO,SI,SI,SI,NO,NO,NO
393,233,ICA,ICA,ICA,,,,12.- ICA,OFICINA REGISTRAL AUXILIAR,ORA,ORA AUGUSTO HERNANDEZ MENDOZA (ESSALUD),08:45 a 16:30,,Calle José Matias Manzanilla S/N,OPERATIVO,SI,SI,NO,SI,SI,SI,NO,NO,NO
394,876,ICA,NASCA,MARCONA,,,,12.- ICA,PUNTO DE ATENCION PERMANENTE,PAP,PAP MARCONA,08:45 a 16:45,,Calle Andres Avelino Caceres S/N,OPERATIVO,SI,NO,SI,SI,SI,NO,NO,NO,NO
395,1193,ICA,ICA,ICA,,,,12.- ICA,MEJOR ATENCION AL CIUDADANO,MAC,MAC - ICA,08:30 a 17:00,,Avenida Los Maestros S/N C.C. Mega Plaza Segundo Piso,OPERATIVO,SI,SI,SI,SI,SI,NO,SI,SI,SI
396,600018,ICA,ICA,ICA,,,,12.- ICA,AGENTE RENIEC,AGENTE,AGENTE RENIEC  - MEGA PLAZA ICA,08:45 a 16:45,,Avenida Los Maestros S/N C.C. Mega Plaza Segundo Piso,OPERATIVO,NO,NO,SI,NO,NO,NO,SI,NO,NO
397,130,AYACUCHO,PAUCAR DES SARA SARA,PAUZA,,,,12.- ICA,PUNTO DE ATENCION PERMANENTE,PAP,PAP PAUCAR DEL SARA SARA,08:45 a 16:45,,Jirón Miguel de Cervantes N° 455 (Palacio Municipal),OPERATIVO,NO,NO,SI,SI,SI,NO,NO,NO,NO
398,143,UCAYALI,CORONEL PORTILLO,CALLERIA,,,,13.- PUCALLPA,OFICINA REGISTRAL AUXILIAR,ORA,ORA HOSPITAL REGIONAL DE PUCALLPA (MINSA),08:45 a 16:30,,Jirón Luis Escavino N° 317,OPERATIVO,SI,NO,NO,SI,SI,SI,NO,NO,NO
399,248,HUANUCO,PUERTO INCA,PUERTO INCA,,,,13.- PUCALLPA,PUNTO DE ATENCION PERMANENTE,PAP,PAP PUERTO INCA,08:45 a 16:45,,Jirón Vulcano S/N,OPERATIVO,NO,NO,SI,SI,SI,NO,NO,NO,NO
400,337,UCAYALI,CORONEL PORTILLO,YARINACOCHA,,,,13.- PUCALLPA,OFICINA REGISTRAL AUXILIAR,ORA,ORA HOSPITAL AMAZÓNICO - YARINACOCHA (MINSA),08:45 a 16:30,,Jirón Aguaytia N° 605,OPERATIVO,SI,NO,NO,SI,SI,SI,NO,NO,NO
401,435,LORETO,UCAYALI,CONTAMANA,,,,13.- PUCALLPA,PUNTO DE ATENCION PERMANENTE,PAP,PAP CONTAMANA,08:45 a 16:45,,Calle Nuevo Loreto Mz.38C  Lt.5B,OPERATIVO,SI,SI,SI,SI,SI,NO,SI,SI,SI
