,,,,,,,,,,,,,,,,,,,,,,,,146
N°,CODIGO SIO DNI NUM,DEPARTAMENTO,PROVINCIA,DISTRITO,CENTRAL TELEFÓNICA,REPRESENTANTE,CORREO,OFICINAS REGIONALES/U.O.,TIPO DE LOCAL,SIGLA TIPO DE LOCAL,CENTRO DE ATENCIÓN,HORARIO DE ATENCIÓN AL PUBLICO,TIPO DE LA VIA,NOMBRE DE LA VIA,"ESTADO
Operativo: Atiente de lunes a viernes
Deplazamiento: Atiende de acuerdo a la programación de RENIEC", ¿Este Centro de Atención toma fotografía? , ¿Este Centro de Atención entrega DNI Electrónico? , TRAMITE DE DNI MAYOR , TRAMITE DE DNI MENOR , ENTREGAS DE DNI , INSCRIPCION DE REGISTROS CIVILES , CERTIFICACION DE REGISTROS CIVILES , CERTIFICACION DEL RUIPN , EREP 
1,53,LAMBAYEQUE,CHICLAYO,CHICLAYO,,,,01.- PIURA,OFICINA REGISTRAL AUXILIAR,ORA,ORA HOSPITAL REGIONAL DOCENTE LAS MERCEDES (MINSA),08:45 a 16:30 ,,Avenida Luis Gonzáles  Nº 635,OPERATIVO,SI,SI,NO,SI,SI,SI,NO,NO,NO
2,88,LAMBAYEQUE,CHICLAYO,CHICLAYO,,,,01.- PIURA,OFICINA REGISTRAL AUXILIAR,ORA,ORA HOSPITAL ALMANZOR AGUINAGA ASENJO (ESSALUD),08:45 a 16:30,,Plaza Plaza de la Seguridad Social S/N,OPERATIVO,SI,SI,NO,SI,SI,SI,NO,NO,NO
3,112,PIURA,SULLANA,SULLANA,,,,01.- PIURA,OFICINA REGISTRAL AUXILIAR,ORA,ORA HOSPITAL DE APOYO II-SULLANA (MINSA),08:45 a 16:30,,Avenida Santa Rosa S/N,OPERATIVO,SI,SI,NO,SI,SI,SI,NO,NO,NO
4,155,CAJAMARCA,CUTERVO,CUTERVO,,,,01.- PIURA,PUNTO DE ATENCION PERMANENTE,PAP,PAP CUTERVO,08:45 a 16:45,,Jirón Comercio N° 1105-1107 Mz. 203 Lt. 14-Urb. Los Jardines ,OPERATIVO,SI,SI,SI,SI,SI,NO,SI,SI,SI
5,156,CAJAMARCA,CHOTA,CHOTA,,,,01.- PIURA,AGENCIA,AG,AG CHOTA,08:45 a 16:45,,Jirón 30 de Agosto N° 848,OPERATIVO,SI,SI,SI,SI,SI,NO,SI,SI,SI
6,159,CAJAMARCA,SANTA CRUZ,SANTA CRUZ,,,,01.- PIURA,PUNTO DE ATENCION PERMANENTE,PAP,PAP SANTA CRUZ,08:45 a 16:45,,Jirón Domingo Negrón Nº 399,OPERATIVO,NO,NO,SI,SI,SI,NO,SI,SI,NO
7,179,LAMBAYEQUE,CHICLAYO,JOSE LEONARDO ORTIZ,,,,01.- PIURA,OFICINA REGISTRAL,OR,OR JOSÉ LEONARDO ORTIZ,08:45 a 16:45,,Calle Cacique Cinto Nº 317 Urb. Latina,OPERATIVO,SI,SI,SI,SI,SI,SI,SI,SI,SI
8,351,LAMBAYEQUE,CHICLAYO,CHICLAYO,,,,01.- PIURA,OFICINA REGISTRAL,OR,OR CHICLAYO,08:45 a 16:45,,Avenida Balta N° 680 y esquina con Av. Elias Aguirre,OPERATIVO,SI,SI,SI,SI,SI,SI,SI,SI,SI
9,352,LAMBAYEQUE,FERREÑAFE,FERREÑAFE,,,,01.- PIURA,PUNTO DE ATENCION PERMANENTE,PAP,PAP FERREÑAFE,08:45 a 16:45,,Calle Tres Marías Nº 717 – B,OPERATIVO,NO,NO,SI,SI,SI,NO,SI,SI,NO
10,353,LAMBAYEQUE,LAMBAYEQUE,LAMBAYEQUE,,,,01.- PIURA,PUNTO DE ATENCION PERMANENTE,PAP,PAP LAMBAYEQUE,08:45 a 16:45,,Avenida Huamachuco N° 342,OPERATIVO,SI,SI,SI,SI,SI,NO,SI,SI,SI
11,473,CAJAMARCA,CUTERVO,CUTERVO,,,,01.- PIURA,OFICINA REGISTRAL AUXILIAR,ORA,ORA SANTA MARIA DE CUTERVO (MINSA),08:45 a 16:30,,Jirón Ica S/N,OPERATIVO,SI,SI,NO,SI,SI,SI,NO,NO,NO
12,474,CAJAMARCA,CHOTA,CHOTA,,,,01.- PIURA,OFICINA REGISTRAL AUXILIAR,ORA,ORA HOSPITAL DE APOYO CHOTA - JOSE SOTO CADENILLAS (MINSA),08:45 a 16:30,,Jirón Ezequiel Montoya Nª 718,OPERATIVO,SI,SI,NO,SI,SI,SI,NO,NO,NO
13,521,PIURA,PIURA,PIURA,,,,01.- PIURA,OFICINA REGISTRAL,OR,OR PIURA,08:45 a 16:45,,Calle Libertad Nº 568,OPERATIVO,SI,SI,SI,SI,SI,SI,SI,SI,SI
14,522,PIURA,AYABACA,AYABACA,,,,01.- PIURA,PUNTO DE ATENCION PERMANENTE,PAP,PAP AYABACA,08:45 a 16:45,,Calle Bolognesi N° 181,OPERATIVO,NO,SI,SI,SI,SI,NO,SI,SI,NO
15,523,PIURA,HUANCABAMBA,HUANCABAMBA,,,,01.- PIURA,PUNTO DE ATENCION PERMANENTE,PAP,PAP HUANCABAMBA,08:45 a 16:45,, Complejo Terminal Terrestre S/N - Stand 14,OPERATIVO,NO,NO,SI,SI,SI,NO,NO,NO,NO
16,524,PIURA,MORROPON,CHULUCANAS,,,,01.- PIURA,AGENCIA,AG,AG CHULUCANAS,08:45 a 16:45,,Jirón Cuzco N° 202,OPERATIVO,SI,SI,SI,SI,SI,NO,SI,SI,SI
17,525,PIURA,PAITA,PAITA,,,,01.- PIURA,PUNTO DE ATENCION PERMANENTE,PAP,PAP PAITA,08:45 a 16:45,,Jirón San Martin S/N Plaza de Armas - Municipalidad de Paita,OPERATIVO,SI,SI,SI,SI,SI,NO,SI,SI,NO
18,526,PIURA,SULLANA,SULLANA,,,,01.- PIURA,OFICINA REGISTRAL,OR,OR SULLANA,08:45 a 16:45,,Calle Leoncio Prado Nº 517 ,OPERATIVO,SI,SI,SI,SI,SI,SI,SI,SI,SI
19,527,PIURA,TALARA,PARIÑAS,,,,01.- PIURA,AGENCIA,AG,AG TALARA,08:45 a 16:45,,Avenida Mártires Petroleros B-3 Conjunto Habitacional - Talara,OPERATIVO,SI,SI,SI,SI,SI,NO,SI,SI,SI
20,528,PIURA,SECHURA,SECHURA,,,,01.- PIURA,PUNTO DE ATENCION PERMANENTE,PAP,PAP SECHURA,08:45 a 16:45,,Calle Dos de Mayo Nº 618 - Plaza de Armas - Municipalidad de Sechura,OPERATIVO,SI,SI,SI,SI,SI,NO,SI,SI,NO
21,531,PIURA,PIURA,TAMBO GRANDE,,,,01.- PIURA,PUNTO DE ATENCION PERMANENTE,PAP,PAP TAMBOGRANDE,08:45 a 16:45,,Jirón Piura 375,OPERATIVO,SI,SI,SI,SI,SI,NO,SI,SI,NO
22,576,PIURA,PIURA,PIURA,,,,01.- PIURA,MEJOR ATENCION AL CIUDADANO,MAC,MAC - PIURA,08:30 a 16:30,,Avenida Sanchez Cerro con Wiesse Centro Comercial Real Plaza,OPERATIVO,SI,SI,SI,SI,SI,NO,SI,SI,SI
23,611,PIURA,PAITA,PAITA,,,,01.- PIURA,OFICINA REGISTRAL AUXILIAR,ORA,ORA HOSPITAL LAS MERCEDES-PAITA (MINSA),08:45 a 16:30,, Zona Industrial Sector II Mz. H Lt. 1 Jr. Los Pescadores S/N ,OPERATIVO,SI,SI,NO,SI,SI,SI,NO,NO,NO
24,641,TUMBES,TUMBES,TUMBES,,,,01.- PIURA,OFICINA REGISTRAL,OR,OR TUMBES,08:45 a 16:45,,Avenida Tumbes Norte  Nº 550,OPERATIVO,SI,SI,SI,SI,SI,SI,SI,SI,SI
25,642,TUMBES,CONTRALMIRANTE VILLAR,ZORRITOS,,,,01.- PIURA,PUNTO DE ATENCION NO PERMANENTE,PANP,PANP CONTRALMIRANTE VILLAR - ZORRITOS,08:45 a 16:45,,Avenida Grau Nº 305,DESPLAZAMIENTO,NO,si,SI,SI,SI,NO,NO,NO,NO
26,643,TUMBES,ZARUMILLA,ZARUMILLA,,,,01.- PIURA,PUNTO DE ATENCION PERMANENTE,PAP,PAP ZARUMILLA,08:45 a 16:45,,Avenida El Ejérrcito Nº 105 - Interior Biblioteca Municipal,OPERATIVO,SI,NO,SI,SI,SI,NO,SI,SI,NO
27,719,LAMBAYEQUE,LAMBAYEQUE,OLMOS,,,,01.- PIURA,PUNTO DE ATENCION NO PERMANENTE,PANP,PANP OLMOS,08:45 a 16:45,,Avenida A. B. Leguía/Calle Alfonso Ugarte,DESPLAZAMIENTO ,NO,si,SI,SI,SI,NO,NO,NO,NO
28,721,PIURA,PIURA,TAMBO GRANDE,,,,01.- PIURA,OFICINA REGISTRAL AUXILIAR,ORA,ORA TAMBO GRANDE (MINSA),08:45 a 16:30,,"Avenida Froilan Alama,, AA.HH.Froilan Alama",OPERATIVO,SI,SI,NO,SI,SI,SI,NO,NO,NO
29,731,LAMBAYEQUE,LAMBAYEQUE,LAMBAYEQUE,,,,01.- PIURA,OFICINA REGISTRAL AUXILIAR,ORA,ORA HOSPITAL PROVINCIAL DOCENTE BELEN-LAMBAYEQUE (MINSA),08:45 a 16:30,,Avenida Ramón Castilla Nº 597,OPERATIVO,SI,SI,NO,SI,SI,SI,NO,NO,NO
30,732,TUMBES,TUMBES,TUMBES,,,,01.- PIURA,OFICINA REGISTRAL AUXILIAR,ORA,ORA HOSPITAL REGIONAL JOSE ALFREDO MENDOZA OLAVARRIA JAMO II-2 (MINSA),08:45 a 16:30,,Avenida 24 de Julio Nº 565 ,OPERATIVO,SI,SI,NO,SI,SI,SI,NO,NO,NO
31,609,PIURA,PIURA,CATACAOS,,,,01.- PIURA,OFICINA REGISTRAL AUXILIAR,ORA,ORA CENTRO DE SALUD MATERNO INFANTIL-CATACAOS (MINSA),08:45 a 16:30,,Avenida Cayetano Heredia 1108 - Catacos,OPERATIVO,SI,SI,NO,SI,SI,SI,NO,NO,NO
32,87,PIURA,PIURA,VEINTISEIS DE OCTUBRE,,,,01.- PIURA,OFICINA REGISTRAL AUXILIAR,ORA,ORA HOSPITAL DE LA AMISTAD PERU - COREA SANTA ROSA II-2 (MINSA),08:45 a 16:30,,Avenida Prolongación Av. Grau/Av. Chulucanas ,OPERATIVO,SI,SI,NO,SI,SI,SI,NO,NO,NO
33,760,LAMBAYEQUE,CHICLAYO,CHICLAYO,,,,01.- PIURA,OFICINA REGISTRAL AUXILIAR,ORA,ORA HOSPITAL REGIONAL LAMBAYEQUE (MINSA),08:45 a 16:30,,Avenida Intersección de Carretera Panamerica Norte y Vía de Evitamiento S/N,OPERATIVO,SI,SI,NO,SI,SI,SI,NO,NO,NO
34,610,PIURA,MORROPON,CHULUCANAS,,,,01.- PIURA,OFICINA REGISTRAL AUXILIAR,ORA,ORA HOSPITAL DE APOYO CHULUCANAS (MINSA),08:45 a 16:30,,Calle Daniel alcides carrion S/N Asent .H. vate manrique,OPERATIVO,SI,SI,NO,SI,SI,SI,NO,NO,NO
35,600016,LAMBAYEQUE,CHICLAYO,CHICLAYO,,,,01.- PIURA,AGENTE RENIEC,AGENTE,AGENTE RENIEC - OR CHICLAYO,08:45 a 16:45,,Avenida Balta N° 680 y esquina con Av. Elias Aguirre,OPERATIVO,NO,NO,SI,NO,NO,NO,SI,NO,NO
36,600022,PIURA,PIURA,PIURA,,,,01.- PIURA,AGENTE RENIEC,AGENTE,AGENTE RENIEC - OR PIURA,08:45 a 16:45,,Calle Libertad Nº 568,OPERATIVO,NO,NO,SI,NO,NO,NO,SI,NO,NO
37,45,LA LIBERTAD,TRUJILLO,TRUJILLO,,,,02.- TRUJILLO,OFICINA REGISTRAL AUXILIAR,ORA,ORA REGIONAL DOCENTE DE TRUJILLO (MINSA),08:45 a 13:00 - 14:00 a 16:30,,Avenida Mansiche Nº 795,OPERATIVO,SI,SI,NO,SI,SI,SI,NO,NO,NO
38,86,CAJAMARCA,CAJAMARCA,CAJAMARCA,,,,02.- TRUJILLO,OFICINA REGISTRAL AUXILIAR,ORA,ORA REGIONAL CAJAMARCA (MINSA),08:45 a 16:30,,Jirón Larry Jhonson S/N Cdra. 8,OPERATIVO,SI,SI,NO,SI,SI,SI,NO,NO,NO
39,139,LA LIBERTAD,TRUJILLO,TRUJILLO,,,,02.- TRUJILLO,OFICINA REGISTRAL AUXILIAR,ORA,ORA HOSPITAL BELEN DE TRUJILLO (MINSA),08:45 a 16:30,,Calle Bolívar Nº 350,OPERATIVO,SI,SI,NO,SI,SI,SI,NO,NO,NO
40,151,CAJAMARCA,CAJAMARCA,CAJAMARCA,,,,02.- TRUJILLO,OFICINA REGISTRAL,OR,OR CAJAMARCA,08:45 a 16:45,,Jirón Del Comercio Nº 633,OPERATIVO,SI,SI,SI,SI,SI,SI,SI,SI,SI
41,152,CAJAMARCA,CAJABAMBA,CAJABAMBA,,,,02.- TRUJILLO,PUNTO DE ATENCION PERMANENTE,PAP,PAP CAJABAMBA,08:45 a 16:45,,Jirón Miguel Grau Nº 224-226-228 Mz. 31 Lt. 2 ,OPERATIVO,SI,SI,SI,SI,SI,NO,SI,SI,NO
42,153,CAJAMARCA,CELENDIN,CELENDÍN,,,,02.- TRUJILLO,PUNTO DE ATENCION PERMANENTE,PAP,PAP CELENDIN,08:45 a 16:45,,Jirón Pardo N° 610,OPERATIVO,SI,SI,SI,SI,SI,NO,SI,SI,NO
43,154,CAJAMARCA,CONTUMAZA,CONTUMAZÁ,,,,02.- TRUJILLO,PUNTO DE ATENCION PERMANENTE,PAP,PAP CONTUMAZA,08:45 a 13:00 - 14:00 a 16:45 ,,Jirón Miguel Grau Nº 212,OPERATIVO,NO,SI,SI,SI,SI,NO,SI,SI,NO
44,157,CAJAMARCA,HUALGAYOC,BAMBAMARCA,,,,02.- TRUJILLO,PUNTO DE ATENCION PERMANENTE,PAP,PAP HUALGAYOC,08:45 a 16:45,,Jirón 07 de Junio Nº 470,OPERATIVO,NO,SI,SI,SI,SI,NO,SI,SI,NO
45,160,CAJAMARCA,SAN MIGUEL,SAN MIGUEL,,,,02.- TRUJILLO,PUNTO DE ATENCION PERMANENTE,PAP,PAP SAN MIGUEL,08:45 a 13:00 - 14:00 a 16:45 ,,Jirón Bolognesi N° 364,OPERATIVO,NO,SI,SI,SI,SI,NO,NO,NO,NO
46,162,CAJAMARCA,SAN MARCOS,PEDRO GÁLVEZ,,,,02.- TRUJILLO,PUNTO DE ATENCION PERMANENTE,PAP,PAP SAN MARCOS,08:45 a 16:45,,Jirón Alfonso Ugarte N° 325 (Mz. 46 Lt. 17 Centro Poblado San Marcos).,OPERATIVO,NO,SI,SI,SI,SI,NO,SI,SI,NO
47,163,CAJAMARCA,SAN PABLO,SAN PABLO,,,,02.- TRUJILLO,PUNTO DE ATENCION PERMANENTE,PAP,PAP SAN PABLO,08:45 a 13:00 - 14:00 a 16:45 ,,Jirón Plaza de Armas S/N,OPERATIVO,NO,SI,SI,SI,SI,NO,SI,SI,NO
48,173,LA LIBERTAD,TRUJILLO,VICTOR LARCO HERRERA,,,,02.- TRUJILLO,OFICINA REGISTRAL,OR,OR TRUJILLO II,08:45 a 16:45,,Avenida Víctor Larco N° 1096. Urb. Vista Alegre,OPERATIVO,SI,SI,SI,SI,SI,SI,SI,SI,SI
49,293,LA LIBERTAD,PATAZ,PARCOY,,,,02.- TRUJILLO,OFICINA REGISTRAL,OR,OR PARCOY,08:45 a 13:00 - 14:00 a 16:45 ,,Jirón San Martín N° 859,OPERATIVO,SI,SI,SI,SI,SI,SI,SI,SI,NO
50,310,LA LIBERTAD,TRUJILLO,TRUJILLO,,,,02.- TRUJILLO,OFICINA REGISTRAL,OR,OR TRUJILLO ,08:45 a 16:45,,Avenida Pablo Casals Mz. A Lt. 6 Urb. Los Cedros,OPERATIVO,SI,SI,SI,SI,SI,SI,SI,SI,SI
51,311,LA LIBERTAD,BOLIVAR,BOLÍVAR,,,,02.- TRUJILLO,PUNTO DE ATENCION PERMANENTE,PAP,PAP BOLIVAR,08:45 a 13:00 - 14:00 a 16:45 ,,Jirón Bolivar S/N - Mz. 20 Lt. 8,OPERATIVO,NO,SI,SI,SI,SI,NO,SI,SI,NO
52,312,LA LIBERTAD,SANCHEZ CARRION,HUAMACHUCO,,,,02.- TRUJILLO,AGENCIA,AG,AG SANCHEZ CARRION,08:45 a 16:45,,Jirón Alfonso Ugarte N° 567,OPERATIVO,SI,SI,SI,SI,SI,NO,SI,SI,SI
53,313,LA LIBERTAD,OTUZCO,OTUZCO,,,,02.- TRUJILLO,AGENCIA,AG,AG OTUZCO,08:45 a 16:45,,Pasaje Elías Armas Castillo Lt. 5-E1 Mz. 28,OPERATIVO,SI,SI,SI,SI,SI,NO,SI,SI,SI
54,314,LA LIBERTAD,PACASMAYO,SAN PEDRO DE LLOC,,,,02.- TRUJILLO,AGENCIA,AG,AG PACASMAYO,08:45 a 16:45,,Jirón Alianza Nº 524,OPERATIVO,SI,SI,SI,SI,SI,NO,SI,SI,SI
55,315,LA LIBERTAD,PATAZ,TAYABAMBA,,,,02.- TRUJILLO,PUNTO DE ATENCION PERMANENTE,PAP,PAP PATAZ,08:45 a 13:00 - 14:00 a 16:45 ,,Jirón Sucre 337 1er Piso Centro Civico,OPERATIVO,NO,SI,SI,SI,SI,NO,NO,NO,NO
56,316,LA LIBERTAD,SANTIAGO DE CHUCO,SANTIAGO DE CHUCO,,,,02.- TRUJILLO,PUNTO DE ATENCION PERMANENTE,PAP,PAP SANTIAGO DE CHUCO,08:45 a 13:00 - 14:00 a 16:45 ,,Calle Luis de La Puente Uceda  Nº 1120,OPERATIVO,NO,SI,SI,SI,SI,NO,SI,SI,NO
57,317,LA LIBERTAD,ASCOPE,ASCOPE,,,,02.- TRUJILLO,PUNTO DE ATENCION PERMANENTE,PAP,PAP ASCOPE,08:45 a 16:45,,"Calle Miguel Grau N° 879, Ascope - 1er Piso",OPERATIVO,NO,SI,SI,SI,SI,NO,SI,SI,NO
58,318,LA LIBERTAD,CHEPEN,CHEPEN,,,,02.- TRUJILLO,PUNTO DE ATENCION PERMANENTE,PAP,PAP CHEPEN,08:45 a 16:45,,Calle Manuel Seoane  N° 136. Chepen,OPERATIVO,SI,SI,SI,SI,SI,NO,SI,SI,NO
59,320,LA LIBERTAD,GRAN CHIMU,CASCAS,,,,02.- TRUJILLO,PUNTO DE ATENCION PERMANENTE,PAP,PAP GRAN CHIMU,08:45 a 13:00 - 14:00 a 16:45 ,,Jr. San Martin S/N ,OPERATIVO,NO,SI,SI,SI,SI,NO,SI,SI,NO
60,321,LA LIBERTAD,VIRU,VIRU,,,,02.- TRUJILLO,PUNTO DE ATENCION PERMANENTE,PAP,PAP VIRU,08:45 a 16:45,,  Mz. A Lt. N° 08 Urb. Las Palmeras,OPERATIVO,SI,SI,SI,SI,SI,NO,SI,SI,NO
61,358,CAJAMARCA,HUALGAYOC,BAMBAMARCA,,,,02.- TRUJILLO,OFICINA REGISTRAL AUXILIAR,ORA,ORA BAMBAMARCA - TITO VILLAR CABEZAS (MINSA),08:45 a 13:00 - 14:00 a 16:30,,Barrio Amazonas - Bambamarca,OPERATIVO,SI,SI,NO,SI,SI,SI,NO,NO,NO
62,359,CAJAMARCA,CELENDIN,CELENDÍN,,,,02.- TRUJILLO,OFICINA REGISTRAL AUXILIAR,ORA,ORA DE APOYO CELENDIN (MINSA),08:45 a 13:00 - 14:00 a 16:30 ,,Avenida Túpac Amaru Cdra. 4,OPERATIVO,SI,SI,NO,SI,SI,SI,NO,NO,NO
63,360,CAJAMARCA,CAJABAMBA,CAJABAMBA,,,,02.- TRUJILLO,OFICINA REGISTRAL AUXILIAR,ORA,ORA HOSPITAL NUESTRA SEÑORA DEL ROSARIO (MINSA),08:45 a 13:00 - 14:00 a 16:30,,Caserio Parubamba,OPERATIVO,SI,SI,NO,SI,SI,SI,NO,NO,NO
64,361,CAJAMARCA,SAN MARCOS,PEDRO GÁLVEZ,,,,02.- TRUJILLO,OFICINA REGISTRAL AUXILIAR,ORA,ORA SAN MARCOS (MINSA),08:45 a 13:00 - 14:00 a 16:30,,Avenida 28 de Julio S/N Cdra.2,DESPLAZAMIENTO,SI,SI,NO,SI,SI,SI,NO,NO,NO
65,508,LA LIBERTAD,TRUJILLO,EL PORVENIR,,,,02.- TRUJILLO,OFICINA REGISTRAL,OR,OR EL PORVENIR,08:45 a 16:45,,Jirón Gabriel Aguilar Nº 1657. 2do piso.,OPERATIVO,SI,SI,SI,SI,SI,SI,SI,SI,SI
66,569,LA LIBERTAD,TRUJILLO,ALTO TRUJILLO,,,,02.- TRUJILLO,OFICINA REGISTRAL,OR,OR ALTO TRUJILLO,08:45 a 16:45,, Barrio 3 Mz T Lt. 2,OPERATIVO,SI,SI,SI,SI,SI,SI,SI,SI,SI
67,592,CAJAMARCA,CAJAMARCA,CAJAMARCA,,,,02.- TRUJILLO,OFICINA REGISTRAL AUXILIAR,ORA,ORA SIMON BOLIVAR (MINSA),08:45 a 16:30,,Avenida Mario Urteaga N° 500,OPERATIVO,SI,SI,NO,SI,SI,SI,NO,NO,NO
68,593,LA LIBERTAD,PACASMAYO,GUADALUPE,,,,02.- TRUJILLO,OFICINA REGISTRAL AUXILIAR,ORA,ORA DE APOYO TOMÁS LAFORA (MINSA),08:45 a 13:00 - 14:00 a 16:30,,Calle La Victoria S/N,OPERATIVO,SI,SI,NO,SI,SI,SI,NO,NO,NO
69,602,CAJAMARCA,CAJAMARCA,LOS BAÑOS DEL INCA,,,,02.- TRUJILLO,OFICINA REGISTRAL AUXILIAR,ORA,ORA BAÑOS DEL INCA (MINSA),08:45 a 13:00 - 14:00 a 16:30,,Jirón Pachacútec N° 489,OPERATIVO,SI,SI,NO,SI,SI,SI,NO,NO,NO
70,604,LA LIBERTAD,TRUJILLO,LA ESPERANZA,,,,02.- TRUJILLO,OFICINA REGISTRAL AUXILIAR,ORA,ORA DISTRITAL JERUSALEN (MINSA),08:45 a 13:00 - 14:00 a 16:30 ,,Pasaje 1 Barrio 3 Mz. 20 Lt. 02 Sector Jerusalén,OPERATIVO,SI,SI,NO,SI,SI,SI,NO,NO,NO
71,605,LA LIBERTAD,PATAZ,CHILLIA,,,,02.- TRUJILLO,AGENCIA,AG,AG CHILLIA,08:45 a 13:00 - 14:00 a 16:45 ,,Jirón Miraflores S/N,OPERATIVO,SI,SI,SI,SI,SI,NO,SI,SI,NO
72,613,LA LIBERTAD,SANTIAGO DE CHUCO,SANTIAGO DE CHUCO,,,,02.- TRUJILLO,OFICINA REGISTRAL AUXILIAR,ORA,ORA DE APOYO CESAR ABRAHAM VALLEJO MENDOZA (MINSA),08:45 a 13:00 - 14:00 a 16:30 ,,Calle Gustavo Pinillo S/N - Barrio San Cristobal,OPERATIVO,SI,SI,NO,SI,SI,SI,NO,NO,NO
73,614,LA LIBERTAD,CHEPEN,CHEPEN,,,,02.- TRUJILLO,OFICINA REGISTRAL AUXILIAR,ORA,ORA DE APOYO CHEPEN (MINSA),08:45 a 13:00 - 14:00 a 16:30 ,,Avenida 28 de Julio S/N,DESPLAZAMIENTO,SI,SI,NO,SI,SI,SI,NO,NO,NO
74,615,LA LIBERTAD,SANCHEZ CARRION,HUAMACHUCO,,,,02.- TRUJILLO,OFICINA REGISTRAL AUXILIAR,ORA,ORA DE APOYO LEONCIO PRADO (MINSA),08:45 a 13:00 - 14:00 a 16:30 ,,Avenida 10 de Julio N° 209,OPERATIVO,SI,SI,NO,SI,SI,SI,NO,NO,NO
75,616,LA LIBERTAD,OTUZCO,OTUZCO,,,,02.- TRUJILLO,OFICINA REGISTRAL AUXILIAR,ORA,ORA DE APOYO OTUZCO ELPIDIO BEROVIDES PEREZ (MINSA),08:45 a 13:00 - 14:00 a 16:30 ,,Calle Progreso N° 385,OPERATIVO,SI,SI,NO,SI,SI,SI,NO,NO,NO
76,617,LA LIBERTAD,ASCOPE,PAIJAN,,,,02.- TRUJILLO,OFICINA REGISTRAL AUXILIAR,ORA,ORA PAIJAN (MINSA),08:45 a 13:00 - 14:00 a 16:30 ,,Carretera Vía Panamericana S/N Sector Manco Capac,DESPLAZAMIENTO,SI,SI,NO,SI,SI,SI,NO,NO,NO
77,795,CAJAMARCA,CAJAMARCA,CAJAMARCA,,,,02.- TRUJILLO,MEJOR ATENCION AL CIUDADANO,MAC,MAC - CAJAMARCA,08:30 a 16:30,,Avenida Via De Evitamiento. Jr. El Mutuy y Av. La Cantuta - Cajamarca - Centro Comercial Real Plaza 2do. Piso,OPERATIVO,SI,SI,SI,SI,SI,NO,SI,SI,SI
78,594,LA LIBERTAD,VIRU,VIRU,,,,02.- TRUJILLO,OFICINA REGISTRAL AUXILIAR,ORA,ORA PROVINCIAL DE VIRÚ (MINSA),08:45 a 13:00 - 14:00 a 16:30,,Calle Sucre Nº 799,OPERATIVO,SI,SI,NO,SI,SI,SI,NO,NO,NO
79,46,LA LIBERTAD,TRUJILLO,TRUJILLO,,,,02.- TRUJILLO,OFICINA REGISTRAL AUXILIAR,ORA,ORA HOSPITAL VÍCTOR LAZARTE ECHEGARAY (ESSALUD),08:45 a 13:00 - 14:00 a 16:30 ,,Avenida Prolongación Unión 1375,OPERATIVO,SI,SI,NO,SI,SI,SI,NO,NO,NO
80,722,CAJAMARCA,CONTUMAZA,CHILETE,,,,02.- TRUJILLO,PUNTO DE ATENCION NO PERMANENTE,PANP,PANP CHILETE,08:45 a 13:00 - 14:00 a 16:45 ,,Jr. Arequipa N° 330,OPERATIVO,NO,SI,SI,SI,SI,NO,NO,NO,NO
81,319,LA LIBERTAD,JULCAN,JULCAN,,,,02.- TRUJILLO,PUNTO DE ATENCION PERMANENTE,PAP,PAP JULCAN,08:45 a 13:00 - 14:00 a 16:45 ,,"Avenida 28 de Julio N° 201, Centro Cívico",OPERATIVO,NO,SI,SI,SI,SI,NO,NO,NO,NO
82,,LA LIBERTAD,TRUJILLO,TRUJILLO,,,,02.- TRUJILLO,AGENTE RENIEC,AGENTE,AGENTE RENIEC - OR TRUJILLO,08:45 a 16:45,,Avenida Pablo Casals Mz. A Lt. 6 Urb. Los Cedros,OPERATIVO,NO,SI,SI,NO,NO,NO,SI,NO,NO
83,109,SAN MARTIN,SAN MARTIN,TARAPOTO,,,,03.- TARAPOTO,OFICINA REGISTRAL AUXILIAR,ORA,ORA HOSPITAL TARAPOTO (MINSA),08:45 a 16:30,,Jirón Angel Delgado Morey Nº 503,OPERATIVO,NO,NO,NO,SI,SI,SI,NO,NO,NO
84,120,LORETO,DATEM DEL MARAÑON,BARRANCA,,,,03.- TARAPOTO,PUNTO DE ATENCION PERMANENTE,PAP,PAP DATEM DEL MARAÑON,08:45 a 16:45,,Calle Tigre Mz. 31 Lt. 08 - San Lorenzo,OPERATIVO,SI,NO,SI,SI,SI,NO,SI,SI,NO
85,331,SAN MARTIN,RIOJA,NUEVA CAJAMARCA,,,,03.- TARAPOTO,AGENCIA,AG,AG NUEVA CAJAMARCA,08:45 a 16:45,,Carretera Fernando Belaunde Terry Altura del Km. 447.50 ,OPERATIVO,SI,NO,SI,SI,SI,NO,SI,SI,NO
86,432,LORETO,ALTO AMAZONAS,YURIMAGUAS,,,,03.- TARAPOTO,AGENCIA,AG,AG ALTO AMAZONAS,08:45 a 16:45,,Calle Mariscal Castilla N° 411,OPERATIVO,SI,SI,SI,SI,SI,NO,SI,SI,SI
87,543,SAN MARTIN,MOYOBAMBA ,MOYOBAMBA,,,,03.- TARAPOTO,OFICINA REGISTRAL AUXILIAR,ORA,ORA HOSPITAL MOYOBAMBA (MINSA),08:45 a 16:30,,Jirón Grau cuadra 4,OPERATIVO,SI,NO,NO,SI,SI,SI,NO,NO,NO
88,581,SAN MARTIN,MOYOBAMBA ,MOYOBAMBA,,,,03.- TARAPOTO,AGENCIA,AG,AG MOYOBAMBA,08:45 a 16:45,,Jirón Dos de Mayo Mz. 1530 Lt. 14 (837),OPERATIVO,SI,SI,SI,SI,SI,NO,SI,SI,SI
89,582,SAN MARTIN,HUALLAGA,SAPOSOA,,,,03.- TARAPOTO,AGENCIA,AG,AG HUALLAGA,08:45 a 16:45,,Jirón Lima N° 591,OPERATIVO,SI,NO,SI,SI,SI,NO,SI,SI,NO
90,583,SAN MARTIN,LAMAS,LAMAS,,,,03.- TARAPOTO,AGENCIA,AG,AG LAMAS,08:45 a 16:45,,Jirón San Martín N° 984,OPERATIVO,SI,SI,SI,SI,SI,NO,SI,SI,SI
91,584,SAN MARTIN,MARISCAL CACERES,JUANJUI,,,,03.- TARAPOTO,AGENCIA,AG,AG MARISCAL CACERES,08:45 a 16:45,,Jirón Eduardo Peña Meza N° 772 ,OPERATIVO,SI,SI,SI,SI,SI,NO,SI,SI,SI
92,585,SAN MARTIN,RIOJA,RIOJA,,,,03.- TARAPOTO,OFICINA REGISTRAL,OR,OR RIOJA,08:45 a 16:45,,Jirón Angaiza N° 530,OPERATIVO,SI,SI,SI,SI,SI,SI,SI,SI,SI
93,586,SAN MARTIN,SAN MARTIN ,TARAPOTO,,,,03.- TARAPOTO,OFICINA REGISTRAL,OR,OR TARAPOTO,08:45 a 16:45,,Jirón Jiménez Pimentel N° 280 ,OPERATIVO,SI,SI,SI,SI,SI,SI,SI,SI,SI
94,587,SAN MARTIN,BELLAVISTA,BELLAVISTA,,,,03.- TARAPOTO,AGENCIA,AG,AG BELLAVISTA,08:45 a 16:45,,Jirón Huallaga - Iquitos Mz. 7 Lt. 27 - A.  1er. Piso,OPERATIVO,SI,SI,SI,SI,SI,NO,SI,SI,SI
95,589,SAN MARTIN,PICOTA,PICOTA,,,,03.- TARAPOTO,AGENCIA,AG,AG PICOTA,08:45 a 16:45,,"Jirón Simón Bolívar, cuadra 4",OPERATIVO,SI,NO,SI,SI,SI,NO,SI,SI,NO
96,590,SAN MARTIN,EL DORADO ,SAN JOSE DE SISA,,,,03.- TARAPOTO,AGENCIA,AG,AG EL DORADO,08:45 a 16:45,,Jirón Comercio N° 610,OPERATIVO,NO,NO,SI,SI,SI,NO,NO,NO,NO
97,601,LORETO,DATEM DEL MARAÑON,BARRANCA,,,,03.- TARAPOTO,OFICINA REGISTRAL AUXILIAR,ORA,ORA SAN LORENZO - NUCLEO BASE (MINSA),08:45 a 16:30,,Barrio Daniel Alcides Carrión S/N - Barrio Huacachina,OPERATIVO,SI,NO,NO,SI,SI,SI,NO,NO,NO
98,612,SAN MARTIN,SAN MARTIN ,LA BANDA DE SHILCAYO,,,,03.- TARAPOTO,AGENCIA,AG,AG LA BANDA DE SHILCAYO,08:45 a 16:45,,Jirón Yurimaguas N° 340,OPERATIVO,SI,SI,SI,SI,SI,NO,SI,SI,SI
99,632,SAN MARTIN,MARISCAL CACERES,JUANJUI,,,,03.- TARAPOTO,OFICINA REGISTRAL AUXILIAR,ORA,ORA HOSPITAL JUANJUI (MINSA),08:45 a 16:30,,Jirón Arica N° 205,OPERATIVO,SI,NO,NO,SI,SI,SI,NO,NO,NO
100,658,SAN MARTIN,RIOJA,RIOJA,,,,03.- TARAPOTO,OFICINA REGISTRAL AUXILIAR,ORA,ORA HOSPITAL DE RIOJA (MINSA),08:45 a 16:30,,Jirón Túpac Amaru S/N,OPERATIVO,SI,NO,NO,SI,SI,SI,NO,NO,NO
101,509,LORETO,ALTO AMAZONAS,LAGUNAS,,,,03.- TARAPOTO,AGENCIA,AG,AG LAGUNAS,08:45 a 16:45,,Jirón FITZCARRALD C-9,OPERATIVO,SI,NO,SI,SI,SI,NO,NO,NO,NO
102,983,SAN MARTIN,SAN MARTIN,MORALES,,,,03.- TARAPOTO,PUNTO DE ATENCION NO PERMANENTE,PANP,PANP MORALES,08:45 a 16:45,,Jirón Tarapoto N° 116 Plaza de Armas,OPERATIVO,SI,NO,SI,SI,SI,NO,SI,SI,NO
103,603,LORETO,ALTO AMAZONAS,YURIMAGUAS,,,,03.- TARAPOTO,OFICINA REGISTRAL AUXILIAR,ORA,ORA HOSPITAL SANTA GEMA YURIMAGUAS (MINSA),08:45 a 16:30,,CALLE HUALLAGA  C-4,OPERATIVO,SI,NO,NO,SI,SI,SI,NO,NO,NO
104,55,LORETO,MAYNAS,PUNCHANA,,,,04.- IQUITOS,OFICINA REGISTRAL AUXILIAR,ORA,"ORA HOSPITAL REGIONAL DE LORETO ""FELIPE ARRIOLA IGLESIAS""",08:45 a 16:30,,Avenida 28 de Julio S/N,OPERATIVO,SI,SI,NO,SI,SI,SI,NO,NO,NO
105,85,LORETO,MAYNAS,IQUITOS,,,,04.- IQUITOS,OFICINA REGISTRAL AUXILIAR,ORA,"ORA HOSPITAL IQUITOS ""CESAR GARAYAR GARCIA""",08:45 a 16:30,,Calle Cornejo Portugal 1710,OPERATIVO,SI,SI,NO,SI,SI,SI,NO,NO,NO
106,332,LORETO,MAYNAS,BELÉN,,,,04.- IQUITOS,OFICINA REGISTRAL,OR,OR BELEN,08:45 a 16:45,,Calle Miraflores S/N P. J. 09 de Octubre,OPERATIVO,SI,SI,SI,SI,SI,SI,SI,SI,NO
107,431,LORETO,MAYNAS,IQUITOS,,,,04.- IQUITOS,OFICINA REGISTRAL,OR,OR IQUITOS,08:45 a 16:45,,Jirón Próspero Nº 201,OPERATIVO,SI,SI,SI,SI,SI,SI,SI,SI,SI
108,433,LORETO,LORETO,NAUTA,,,,04.- IQUITOS,PUNTO DE ATENCION PERMANENTE,PAP,PAP NAUTA,08:45 a 16:45,,Cal. Manuel Pacaya N° 570 centro cívico,OPERATIVO,SI,SI,SI,SI,SI,NO,SI,SI,NO
109,434,LORETO,REQUENA,REQUENA,,,,04.- IQUITOS,PUNTO DE ATENCION PERMANENTE,PAP,PAP REQUENA,08:45 a 16:45,,Calle San Antonio S/N Anexo Hotel Municipal,OPERATIVO,SI,SI,SI,SI,SI,NO,SI,SI,NO
110,436,LORETO,MARISCAL RAMON CASTILLA,RAMON CASTILLA,,,,04.- IQUITOS,PUNTO DE ATENCION PERMANENTE,PAP,PAP MARISCAL RAMON CASTILLA - CABALLOCOCHA,08:45 a 16:45,,Calle Ayacucho Mz. 22 Lt. 4 C con Amazonas S/N - Local Municipal,OPERATIVO,SI,SI,SI,SI,SI,NO,SI,SI,NO
111,438,LORETO,MAYNAS,SAN JUAN BAUTISTA,,,,04.- IQUITOS,OFICINA REGISTRAL,OR,OR SAN JUAN BAUTISTA,08:45 a 16:45,,Avenida Abelardo Quiñones Nº 2371 Km. 2.5 ,OPERATIVO,SI,SI,SI,SI,SI,SI,SI,SI,NO
112,439,LORETO,MARISCAL RAMON CASTILLA,YAVARI,,,,04.- IQUITOS,PUNTO DE ATENCION PERMANENTE,PAP,PAP YAVARI,08:45 a 16:45,,Calle Nueva Jerusalen S/N Local Municipal,OPERATIVO,NO,SI,SI,SI,SI,NO,NO,NO,NO
113,440,LORETO,PUTUMAYO,PUTUMAYO,,,,04.- IQUITOS,PUNTO DE ATENCION PERMANENTE,PAP,PAP PUTUMAYO,08:45 a 16:45,,Calle Arequipa S/N,OPERATIVO,NO,SI,SI,SI,SI,NO,NO,NO,NO
114,449,LORETO,MAYNAS,PUNCHANA,,,,04.- IQUITOS,PUNTO DE ATENCION PERMANENTE,PAP,PAP PUNCHANA,08:45 a 16:45,,"Calle Cusco S/N, cuadra 5, esquina con Trujillo.",OPERATIVO,SI,SI,SI,SI,SI,NO,SI,NO,NO
115,645,LORETO,REQUENA,REQUENA,,,,04.- IQUITOS,OFICINA REGISTRAL AUXILIAR,ORA,ORA REQUENA,08:45 a 16:30,,Calle Mártires del Petroléo S/N - Malecon Grau,OPERATIVO,SI,SI,NO,SI,SI,SI,NO,NO,NO
116,711,LORETO,MARISCAL RAMON CASTILLA,RAMON CASTILLA,,,,04.- IQUITOS,OFICINA REGISTRAL AUXILIAR,ORA,ORA CABALLOCOCHA,08:45 a 16:30,,Calle Progreso N° 425,OPERATIVO,si,SI,NO,SI,SI,SI,NO,NO,NO
117,806,LORETO,MAYNAS,PUNCHANA,,,,04.- IQUITOS,MEJOR ATENCION AL CIUDADANO,MAC,MAC - LORETO,08:30 a 16:30,,Avenida La Marina Nº  1338,OPERATIVO,SI,SI,SI,SI,SI,NO,SI,SI,NO
118,600019,LORETO,MAYNAS,IQUITOS,,,,04.- IQUITOS,AGENTE RENIEC,AGENTE,AGENTE RENIEC - OR IQUITOS,08:45 a 16:45,,Jirón Próspero Nº 201,OPERATIVO,NO,SI,SI,NO,NO,NO,SI,NO,NO
119,339,LORETO,PUTUMAYO,TENIENTE MANUEL CLAVERO,,,,04.- IQUITOS,PUNTO DE ATENCION NO PERMANENTE,PANP,PANP SOPLIN VARGAS,08:45 a 16:45,,Plaza de armas S/N,OPERATIVO,NO,SI,SI,SI,SI,NO,NO,NO,NO
120,001204,LORETO,MARISCAL RAMON CASTILLA,SANTA ROSA DE LORETO,,,,04.- IQUITOS,PUNTO DE ATENCIÓN PERMANENTE,PAP,PAP SANTA ROSA DE LORETO ,08:45 a 16:45,,Calle mi Perú S/N,OPERATIVO,NO,SI,SI,SI,SI,NO,NO,NO,NO
121,33,ANCASH,SANTA,CHIMBOTE,,,,05.- CHIMBOTE,OFICINA REGISTRAL,OR,OR SANTA,08:45 a 16:45,,Jirón Enrique Palacios Nº 504-506 esquina con Jr. Ladislao Espinar Nº 401,OPERATIVO,SI,SI,SI,SI,SI,SI,SI,SI,SI
122,,ANCASH,SANTA,CHIMBOTE,,,,05.- CHIMBOTE,AGENTE RENIEC,AGENTE,AGENTE RENIEC - MEGA PLAZA CHIMBOTE,08:45 a 16:45,," Mz. B Lt. 1-A-1-A2 Sector Parque Gran Chavín, Centro Comercial Megaplaza Chimbote",OPERATIVO,NO,NO,NO,NO,NO,NO,SI,SI,NO
123,1182,ANCASH,SANTA,CHIMBOTE,,,,05.- CHIMBOTE,MEJOR ATENCION AL CIUDADANO,MAC,MAC - ANCASH,08:30 a 16:30,," Mz. B Lt. 1-A-1-A2 Sector Parque Gran Chavín, Centro Comercial Megaplaza Chimbote",OPERATIVO,SI,SI,SI,SI,SI,NO,SI,SI,SI
124,137,ANCASH,SANTA,NUEVO CHIMBOTE,,,,05.- CHIMBOTE,AGENCIA,AG,AG NUEVO CHIMBOTE,08:45 a 16:45,, Mz. 74-75 Lt. 1 del Centro Cívico de la Municipalidad Distrital de Nuevo Chimbote,OPERATIVO,SI,SI,SI,SI,SI,NO,SI,SI,SI
125,21,ANCASH,HUARAZ,HUARAZ,,,,05.- CHIMBOTE,AGENCIA,AG,AG HUARAZ,08:45 a 16:45,,"Jirón Agustin Loly N° 756, Mz. 29A Lt. 27, Barrio La Soledad Alta, intersección con Jr. Agustin Mejía",OPERATIVO,SI,SI,SI,SI,SI,NO,SI,SI,SI
126,27,ANCASH,HUAYLAS,CARAZ,,,,05.- CHIMBOTE,AGENCIA,AG,AG HUAYLAS,08:45 a 16:45,,Jirón Raimondi N° 215,OPERATIVO,SI,SI,SI,SI,SI,NO,SI,SI,SI
127,28,ANCASH,HUARI,HUARI,,,,05.- CHIMBOTE,AGENCIA,AG,AG HUARI,08:45 a 16:45,,Jirón Libertad Mz. P2 Lt. 003,OPERATIVO,SI,SI,SI,SI,SI,NO,SI,SI,SI
128,31,ANCASH,POMABAMBA,POMABAMBA,,,,05.- CHIMBOTE,AGENCIA,AG,AG POMABAMBA,08:45 a 16:45,,Jirón Huaraz Nº 369,OPERATIVO,SI,SI,SI,SI,SI,NO,SI,SI,SI
129,34,ANCASH,SIHUAS,SIHUAS,,,,05.- CHIMBOTE,AGENCIA,AG,AG SIHUAS,08:45 a 16:45,,"Jirón Gomes Arias 106, Barrio Pingullo Alto",OPERATIVO,SI,SI,SI,SI,SI,NO,SI,SI,SI
130,518,ANCASH,PALLASCA,PAMPAS,,,,05.- CHIMBOTE,AGENCIA,AG,AG PAMPAS,08:45 a 16:45,,Calle Plaza de Armas S/N - Municipalidad Distrital de Pampas - 1er piso,OPERATIVO,SI,SI,SI,SI,SI,NO,SI,SI,NO
