CENTROS DE ATENCIÓN DEL RENIEC A NIVEL NACIONAL A JULIO 2025;;;;;;;;;;;;;;;;;;;;;;;
;;;;;;;;;;;;;;;;;;;;;;;
N°;CODIGO SIO DNI NUM;DEPARTAMENTO;PROVINCIA;DISTRITO;OFICINAS REGIONALES/U.O.;TIPO DE LOCAL;SIGLA TIPO DE LOCAL;CENTRO DE ATENCIÓN;HORARIO DE ATENCIÓN AL PUBLICO;NOMBRE DE LA VIA;"ESTADO
Operativo: Atiente de lunes a viernes
Deplazamiento: Atiende de acuerdo a la programación de RENIEC"; ¿Este Centro de Atención toma fotografía? ; ¿Este Centro de Atención entrega DNI Electrónico? ; TRAMITE DE DNI MAYOR ; TRAMITE DE DNI MENOR ; ENTREGAS DE DNI ; INSCRIPCION DE REGISTROS CIVILES ; CERTIFICACION DE REGISTROS CIVILES ; CERTIFICACION DEL RUIPN ; EREP ;;;
1;53;LAMBAYEQUE;CHICLAYO;CHICLAYO;;;;ORA HOSPITAL REGIONAL DOCENTE LAS MERCEDES (MINSA);08:45 a 16:30 ;Avenida Luis Gonzáles  Nº 635;OPERATIVO;SI;SI;NO;SI;SI;SI;NO;NO;NO;;;
2;88;LAMBAYEQUE;CHICLAYO;CHICLAYO;;;;ORA HOSPITAL ALMANZOR AGUINAGA ASENJO (ESSALUD);08:45 a 16:30;Plaza Plaza de la Seguridad Social S/N;OPERATIVO;SI;SI;NO;SI;SI;SI;NO;NO;NO;;;
3;112;PIURA;SULLANA;SULLANA;;;;ORA HOSPITAL DE APOYO II-SULLANA (MINSA);08:45 a 16:30;Avenida Santa Rosa S/N;OPERATIVO;SI;SI;NO;SI;SI;SI;NO;NO;NO;;;
4;155;CAJAMARCA;CUTERVO;CUTERVO;;;;PAP CUTERVO;08:45 a 16:45;Jirón Comercio N° 1105-1107 Mz. 203 Lt. 14-Urb. Los Jardines ;OPERATIVO;SI;SI;SI;SI;SI;NO;SI;SI;SI;;;
5;156;CAJAMARCA;CHOTA;CHOTA;;;;AG CHOTA;08:45 a 16:45;Jirón 30 de Agosto N° 848;OPERATIVO;SI;SI;SI;SI;SI;NO;SI;SI;SI;;;
6;159;CAJAMARCA;SANTA CRUZ;SANTA CRUZ;;;;PAP SANTA CRUZ;08:45 a 16:45;Jirón Domingo Negrón Nº 399;OPERATIVO;NO;NO;SI;SI;SI;NO;SI;SI;NO;;;
7;179;LAMBAYEQUE;CHICLAYO;JOSE LEONARDO ORTIZ;;;;OR JOSÉ LEONARDO ORTIZ;08:45 a 16:45;Calle Cacique Cinto Nº 317 Urb. Latina;OPERATIVO;SI;SI;SI;SI;SI;SI;SI;SI;SI;;;
8;351;LAMBAYEQUE;CHICLAYO;CHICLAYO;;;;OR CHICLAYO;08:45 a 16:45;Avenida Balta N° 680 y esquina con Av. Elias Aguirre;OPERATIVO;SI;SI;SI;SI;SI;SI;SI;SI;SI;;;
9;352;LAMBAYEQUE;FERREÑAFE;FERREÑAFE;;;;PAP FERREÑAFE;08:45 a 16:45;Calle Tres Marías Nº 717 – B;OPERATIVO;NO;NO;SI;SI;SI;NO;SI;SI;NO;;;
10;353;LAMBAYEQUE;LAMBAYEQUE;LAMBAYEQUE;;;;PAP LAMBAYEQUE;08:45 a 16:45;Avenida Huamachuco N° 342;OPERATIVO;SI;SI;SI;SI;SI;NO;SI;SI;SI;;;
11;473;CAJAMARCA;CUTERVO;CUTERVO;;;;ORA SANTA MARIA DE CUTERVO (MINSA);08:45 a 16:30;Jirón Ica S/N;OPERATIVO;SI;SI;NO;SI;SI;SI;NO;NO;NO;;;
12;474;CAJAMARCA;CHOTA;CHOTA;;;;ORA HOSPITAL DE APOYO CHOTA - JOSE SOTO CADENILLAS (MINSA);08:45 a 16:30;Jirón Ezequiel Montoya Nª 718;OPERATIVO;SI;SI;NO;SI;SI;SI;NO;NO;NO;;;
13;521;PIURA;PIURA;PIURA;;;;OR PIURA;08:45 a 16:45;Calle Libertad Nº 568;OPERATIVO;SI;SI;SI;SI;SI;SI;SI;SI;SI;;;
14;522;PIURA;AYABACA;AYABACA;;;;PAP AYABACA;08:45 a 16:45;Calle Bolognesi N° 181;OPERATIVO;NO;NO;SI;SI;SI;NO;SI;SI;NO;;;
15;523;PIURA;HUANCABAMBA;HUANCABAMBA;;;;PAP HUANCABAMBA;08:45 a 16:45; Complejo Terminal Terrestre S/N - Stand 14;OPERATIVO;NO;NO;SI;SI;SI;NO;NO;NO;NO;;;
16;524;PIURA;MORROPON;CHULUCANAS;;;;AG CHULUCANAS;08:45 a 16:45;Jirón Cuzco N° 202;OPERATIVO;SI;SI;SI;SI;SI;NO;SI;SI;SI;;;
17;525;PIURA;PAITA;PAITA;;;;PAP PAITA;08:45 a 16:45;Jirón San Martin S/N Plaza de Armas - Municipalidad de Paita;OPERATIVO;SI;NO;SI;SI;SI;NO;SI;SI;NO;;;
18;526;PIURA;SULLANA;SULLANA;;;;OR SULLANA;08:45 a 16:45;Calle Leoncio Prado Nº 517 ;OPERATIVO;SI;SI;SI;SI;SI;SI;SI;SI;SI;;;
19;527;PIURA;TALARA;PARIÑAS;;;;AG TALARA;08:45 a 16:45;Avenida Mártires Petroleros B-3 Conjunto Habitacional - Talara;OPERATIVO;SI;SI;SI;SI;SI;NO;SI;SI;SI;;;
20;528;PIURA;SECHURA;SECHURA;;;;PAP SECHURA;08:45 a 16:45;Calle Dos de Mayo Nº 618 - Plaza de Armas - Municipalidad de Sechura;OPERATIVO;SI;NO;SI;SI;SI;NO;SI;SI;NO;;;
21;531;PIURA;PIURA;TAMBO GRANDE;;;;PAP TAMBOGRANDE;08:45 a 16:45;Jirón Piura 375;OPERATIVO;SI;NO;SI;SI;SI;NO;SI;SI;NO;;;
22;576;PIURA;PIURA;PIURA;;;;MAC - PIURA;08:30 a 16:30;Avenida Sanchez Cerro con Wiesse Centro Comercial Real Plaza;OPERATIVO;SI;SI;SI;SI;SI;NO;SI;SI;SI;;;
23;611;PIURA;PAITA;PAITA;;;;ORA HOSPITAL LAS MERCEDES-PAITA (MINSA);08:45 a 16:30; Zona Industrial Sector II Mz. H Lt. 1 Jr. Los Pescadores S/N ;OPERATIVO;SI;SI;NO;SI;SI;SI;NO;NO;NO;;;
24;641;TUMBES;TUMBES;TUMBES;;;;OR TUMBES;08:45 a 16:45;Avenida Tumbes Norte  Nº 550;OPERATIVO;SI;SI;SI;SI;SI;SI;SI;SI;SI;;;
25;642;TUMBES;CONTRALMIRANTE VILLAR;ZORRITOS;;;;PANP CONTRALMIRANTE VILLAR - ZORRITOS;08:45 a 16:45;Avenida Grau Nº 305;DESPLAZAMIENTO;NO;NO;SI;SI;SI;NO;NO;NO;NO;;;
26;643;TUMBES;ZARUMILLA;ZARUMILLA;;;;PAP ZARUMILLA;08:45 a 16:45;Avenida El Ejérrcito Nº 105 - Interior Biblioteca Municipal;OPERATIVO;SI;NO;SI;SI;SI;NO;SI;SI;NO;;;
27;721;PIURA;PIURA;TAMBO GRANDE;;;;ORA TAMBO GRANDE (MINSA);08:45 a 16:30;Avenida Froilan Alama,, AA.HH.Froilan Alama;OPERATIVO;SI;SI;NO;SI;SI;SI;NO;NO;NO;;;
28;731;LAMBAYEQUE;LAMBAYEQUE;LAMBAYEQUE;;;;ORA HOSPITAL PROVINCIAL DOCENTE BELEN-LAMBAYEQUE (MINSA);08:45 a 16:30;Avenida Ramón Castilla Nº 597;OPERATIVO;SI;SI;NO;SI;SI;SI;NO;NO;NO;;;
29;732;TUMBES;TUMBES;TUMBES;;;;ORA HOSPITAL REGIONAL JOSE ALFREDO MENDOZA OLAVARRIA JAMO II-2 (MINSA);08:45 a 16:30;Avenida 24 de Julio Nº 565 ;OPERATIVO;SI;SI;NO;SI;SI;SI;NO;NO;NO;;;
30;609;PIURA;PIURA;CATACAOS;;;;ORA CENTRO DE SALUD MATERNO INFANTIL-CATACAOS (MINSA);08:45 a 16:30;Avenida Cayetano Heredia 1108 - Catacos;OPERATIVO;SI;SI;NO;SI;SI;SI;NO;NO;NO;;;
31;87;PIURA;PIURA;VEINTISEIS DE OCTUBRE;;;;ORA HOSPITAL DE LA AMISTAD PERU - COREA SANTA ROSA II-2 (MINSA);08:45 a 16:30;Avenida Prolongación Av. Grau/Av. Chulucanas ;OPERATIVO;SI;SI;NO;SI;SI;SI;NO;NO;NO;;;
32;760;LAMBAYEQUE;CHICLAYO;CHICLAYO;;;;ORA HOSPITAL REGIONAL LAMBAYEQUE (MINSA);08:45 a 16:30;Avenida Intersección de Carretera Panamerica Norte y Vía de Evitamiento S/N;OPERATIVO;SI;SI;NO;SI;SI;SI;NO;NO;NO;;;
33;610;PIURA;MORROPON;CHULUCANAS;;;;ORA HOSPITAL DE APOYO CHULUCANAS (MINSA);08:45 a 16:30;Calle Daniel alcides carrion S/N Asent .H. vate manrique;OPERATIVO;SI;SI;NO;SI;SI;SI;NO;NO;NO;;;
34;600016;LAMBAYEQUE;CHICLAYO;CHICLAYO;;;;AGENTE RENIEC - OR CHICLAYO;08:45 a 16:45;Avenida Balta N° 680 y esquina con Av. Elias Aguirre;OPERATIVO;NO;NO;SI;NO;NO;NO;SI;NO;NO;;;
35;600022;PIURA;PIURA;PIURA;;;;AGENTE RENIEC - OR PIURA;08:45 a 16:45;Calle Libertad Nº 568;OPERATIVO;NO;NO;SI;NO;NO;NO;SI;NO;NO;;;
36;45;LA LIBERTAD;TRUJILLO;TRUJILLO;;;;ORA REGIONAL DOCENTE DE TRUJILLO (MINSA);08:45 a 13:00 - 14:00 a 16:30;Avenida Mansiche Nº 795;OPERATIVO;SI;NO;NO;SI;SI;SI;NO;NO;NO;;;
37;86;CAJAMARCA;CAJAMARCA;CAJAMARCA;;;;ORA REGIONAL CAJAMARCA (MINSA);08:45 a 13:00 - 14:00 a 16:30 ;Jirón Larry Jhonson S/N Cdra. 8;OPERATIVO;SI;NO;NO;SI;SI;SI;NO;NO;NO;;;
38;139;LA LIBERTAD;TRUJILLO;TRUJILLO;;;;ORA HOSPITAL BELEN DE TRUJILLO (MINSA);08:45 a 16:30;Calle Bolívar Nº 350;OPERATIVO;SI;NO;NO;SI;SI;SI;NO;NO;NO;;;
39;151;CAJAMARCA;CAJAMARCA;CAJAMARCA;;;;OR CAJAMARCA;08:45 a 16:45;Jirón Del Comercio Nº 633;OPERATIVO;SI;SI;SI;SI;SI;SI;SI;SI;SI;;;
40;152;CAJAMARCA;CAJABAMBA;CAJABAMBA;;;;PAP CAJABAMBA;08:45 a 16:45;Jirón Miguel Grau Nº 224-226-228 Mz. 31 Lt. 2 ;OPERATIVO;SI;NO;SI;SI;SI;NO;SI;SI;NO;;;
41;153;CAJAMARCA;CELENDIN;CELENDÍN;;;;PAP CELENDIN;08:45 a 16:45;Jirón Pardo N° 610;OPERATIVO;SI;NO;SI;SI;SI;NO;SI;SI;NO;;;
42;154;CAJAMARCA;CONTUMAZA;CONTUMAZÁ;;;;PAP CONTUMAZA;08:45 a 13:00 - 14:00 a 16:45 ;Jirón Miguel Grau Nº 212;OPERATIVO;NO;NO;SI;SI;SI;NO;SI;SI;NO;;;
43;157;CAJAMARCA;HUALGAYOC;BAMBAMARCA;;;;PAP HUALGAYOC;08:45 a 16:45;Jirón 07 de Junio Nº 470;OPERATIVO;SI;NO;SI;SI;SI;NO;SI;SI;NO;;;
44;160;CAJAMARCA;SAN MIGUEL;SAN MIGUEL;;;;PAP SAN MIGUEL;08:45 a 13:00 - 14:00 a 16:45 ;Jirón Bolognesi N° 364;OPERATIVO;NO;NO;SI;SI;SI;NO;NO;NO;NO;;;
45;162;CAJAMARCA;SAN MARCOS;PEDRO GÁLVEZ;;;;PAP SAN MARCOS;08:45 a 16:45;Jirón Alfonso Ugarte N° 325 (Mz. 46 Lt. 17 Centro Poblado San Marcos).;OPERATIVO;NO;NO;SI;SI;SI;NO;SI;SI;NO;;;
46;163;CAJAMARCA;SAN PABLO;SAN PABLO;;;;PAP SAN PABLO;08:45 a 13:00 - 14:00 a 16:45 ;Jirón Plaza de Armas S/N;OPERATIVO;NO;NO;SI;SI;SI;NO;SI;SI;NO;;;
47;173;LA LIBERTAD;TRUJILLO;VICTOR LARCO HERRERA;;;;OR TRUJILLO II;08:45 a 16:45;Avenida Víctor Larco N° 1096. Urb. Vista Alegre;OPERATIVO;SI;SI;SI;SI;SI;SI;SI;SI;SI;;;
48;293;LA LIBERTAD;PATAZ;PARCOY;;;;OR PARCOY;08:45 a 13:00 - 14:00 a 16:45 ;Jirón San Martín N° 859;OPERATIVO;SI;NO;SI;SI;SI;SI;SI;SI;NO;;;
49;310;LA LIBERTAD;TRUJILLO;TRUJILLO;;;;OR TRUJILLO ;08:45 a 16:45;Avenida Pablo Casals Mz. A Lt. 6 Urb. Los Cedros;OPERATIVO;SI;SI;SI;SI;SI;SI;SI;SI;SI;;;
50;311;LA LIBERTAD;BOLIVAR;BOLÍVAR;;;;PAP BOLIVAR;08:45 a 13:00 - 14:00 a 16:45 ;Jirón Bolivar S/N - Mz. 20 Lt. 8;OPERATIVO;NO;NO;SI;SI;SI;NO;SI;SI;NO;;;
51;312;LA LIBERTAD;SANCHEZ CARRION;HUAMACHUCO;;;;AG SANCHEZ CARRION;08:45 a 16:45;Jirón Alfonso Ugarte N° 567;OPERATIVO;SI;SI;SI;SI;SI;NO;SI;SI;SI;;;
52;313;LA LIBERTAD;OTUZCO;OTUZCO;;;;AG OTUZCO;08:45 a 16:45;Pasaje Elías Armas Castillo Lt. 5-E1 Mz. 28;OPERATIVO;SI;SI;SI;SI;SI;NO;SI;SI;SI;;;
53;314;LA LIBERTAD;PACASMAYO;SAN PEDRO DE LLOC;;;;AG PACASMAYO;08:45 a 16:45;Jirón Alianza Nº 524;OPERATIVO;SI;SI;SI;SI;SI;NO;SI;SI;SI;;;
54;316;LA LIBERTAD;SANTIAGO DE CHUCO;SANTIAGO DE CHUCO;;;;PAP SANTIAGO DE CHUCO;08:45 a 13:00 - 14:00 a 16:45 ;Calle Luis de La Puente Uceda  Nº 1120;OPERATIVO;NO;NO;SI;SI;SI;NO;SI;SI;NO;;;
55;317;LA LIBERTAD;ASCOPE;ASCOPE;;;;PAP ASCOPE;08:45 a 16:45;Calle Miguel Grau N° 879, Ascope - 1er Piso;OPERATIVO;NO;NO;SI;SI;SI;NO;SI;SI;NO;;;
56;318;LA LIBERTAD;CHEPEN;CHEPEN;;;;PAP CHEPEN;08:45 a 16:45;Calle Manuel Seoane  N° 136. Chepen;OPERATIVO;SI;NO;SI;SI;SI;NO;SI;SI;NO;;;
57;320;LA LIBERTAD;GRAN CHIMU;CASCAS;;;;PAP GRAN CHIMU;08:45 a 13:00 - 14:00 a 16:45 ;Jr. San Martin S/N ;OPERATIVO;NO;NO;SI;SI;SI;NO;SI;SI;NO;;;
58;321;LA LIBERTAD;VIRU;VIRU;;;;PAP VIRU;08:45 a 16:45;  Mz. A Lt. N° 08 Urb. Las Palmeras;OPERATIVO;SI;NO;SI;SI;SI;NO;SI;SI;NO;;;
59;358;CAJAMARCA;HUALGAYOC;BAMBAMARCA;;;;ORA BAMBAMARCA - TITO VILLAR CABEZAS (MINSA);08:45 a 13:00 - 14:00 a 16:30;Caserío El Frutillo. Bambamarca;OPERATIVO;SI;NO;NO;SI;SI;SI;NO;NO;NO;;;
60;359;CAJAMARCA;CELENDIN;CELENDÍN;;;;ORA DE APOYO CELENDIN (MINSA);08:45 a 13:00 - 14:00 a 16:30 ;Avenida Túpac Amaru Cdra. 4;OPERATIVO;SI;NO;NO;SI;SI;SI;NO;NO;NO;;;
61;360;CAJAMARCA;CAJABAMBA;CAJABAMBA;;;;ORA HOSPITAL NUESTRA SEÑORA DEL ROSARIO (MINSA);08:45 a 13:00 - 14:00 a 16:30;Jirón La Torre N° 277;OPERATIVO;SI;NO;NO;SI;SI;SI;NO;NO;NO;;;
62;361;CAJAMARCA;SAN MARCOS;PEDRO GÁLVEZ;;;;ORA SAN MARCOS (MINSA);08:45 a 13:00 - 14:00 a 16:30;Avenida 28 de Julio S/N Cdra.2;OPERATIVO;SI;NO;NO;SI;SI;SI;NO;NO;NO;;;
63;508;LA LIBERTAD;TRUJILLO;EL PORVENIR;;;;OR EL PORVENIR;08:45 a 16:45;Jirón Gabriel Aguilar Nº 1657. 2do piso.;OPERATIVO;SI;SI;SI;SI;SI;SI;SI;SI;SI;;;
64;569;LA LIBERTAD;TRUJILLO;ALTO TRUJILLO;;;;OR ALTO TRUJILLO;08:45 a 16:45; Barrio 3 Mz T Lt. 2;OPERATIVO;SI;SI;SI;SI;SI;SI;SI;SI;SI;;;
65;592;CAJAMARCA;CAJAMARCA;CAJAMARCA;;;;ORA SIMON BOLIVAR (MINSA);08:45 a 13:00 - 14:00 a 16:30;Avenida Mario Urteaga N° 500;OPERATIVO;SI;NO;NO;SI;SI;SI;NO;NO;NO;;;
66;593;LA LIBERTAD;PACASMAYO;GUADALUPE;;;;ORA DE APOYO TOMÁS LAFORA (MINSA);08:45 a 13:00 - 14:00 a 16:30;Calle La Victoria S/N;OPERATIVO;SI;NO;NO;SI;SI;SI;NO;NO;NO;;;
67;602;CAJAMARCA;CAJAMARCA;LOS BAÑOS DEL INCA;;;;ORA BAÑOS DEL INCA (MINSA);08:45 a 13:00 - 14:00 a 16:30;Jirón Pachacútec N° 489;DESPLAZAMIENTO;SI;NO;NO;SI;SI;SI;NO;NO;NO;;;
68;604;LA LIBERTAD;TRUJILLO;LA ESPERANZA;;;;ORA DISTRITAL JERUSALEN (MINSA);08:45 a 13:00 - 14:00 a 16:30 ;Pasaje 1 Barrio 3 Mz. 20 Lt. 02 Sector Jerusalén;OPERATIVO;SI;NO;NO;SI;SI;SI;NO;NO;NO;;;
69;605;LA LIBERTAD;PATAZ;CHILLIA;;;;AG CHILLIA;08:45 a 13:00 - 14:00 a 16:45 ;Jirón Miraflores S/N;OPERATIVO;SI;NO;SI;SI;SI;NO;SI;SI;NO;;;
70;613;LA LIBERTAD;SANTIAGO DE CHUCO;SANTIAGO DE CHUCO;;;;ORA DE APOYO CESAR ABRAHAM VALLEJO MENDOZA (MINSA);08:45 a 13:00 - 14:00 a 16:30 ;Calle Gustavo Pinillo S/N - Barrio San Cristobal;OPERATIVO;SI;NO;NO;SI;SI;SI;NO;NO;NO;;;
71;614;LA LIBERTAD;CHEPEN;CHEPEN;;;;ORA DE APOYO CHEPEN (MINSA);08:45 a 13:00 - 14:00 a 16:30 ;Avenida 28 de Julio S/N;DESPLAZAMIENTO;SI;NO;NO;SI;SI;SI;NO;NO;NO;;;
72;615;LA LIBERTAD;SANCHEZ CARRION;HUAMACHUCO;;;;ORA DE APOYO LEONCIO PRADO (MINSA);08:45 a 13:00 - 14:00 a 16:30 ;Avenida 10 de Julio N° 209;OPERATIVO;SI;NO;NO;SI;SI;SI;NO;NO;NO;;;
73;616;LA LIBERTAD;OTUZCO;OTUZCO;;;;ORA DE APOYO OTUZCO ELPIDIO BEROVIDES PEREZ (MINSA);08:45 a 13:00 - 14:00 a 16:30 ;Calle Progreso N° 385;OPERATIVO;SI;NO;NO;SI;SI;SI;NO;NO;NO;;;
74;617;LA LIBERTAD;ASCOPE;PAIJAN;;;;ORA PAIJAN (MINSA);08:45 a 13:00 - 14:00 a 16:30 ;Carretera Vía Panamericana S/N Sector Manco Capac;DESPLAZAMIENTO;SI;NO;NO;SI;SI;SI;NO;NO;NO;;;
75;795;CAJAMARCA;CAJAMARCA;CAJAMARCA;;;;MAC - CAJAMARCA;08:30 a 16:30;Avenida Via De Evitamiento. Jr. El Mutuy y Av. La Cantuta - Cajamarca - Centro Comercial Real Plaza 2do. Piso;OPERATIVO;SI;SI;SI;SI;SI;NO;SI;SI;SI;;;
76;46;LA LIBERTAD;VIRU;VIRU;;;;ORA PROVINCIAL DE VIRÚ (MINSA);08:45 a 13:00 - 14:00 a 16:30;Calle Sucre Nº 799;OPERATIVO;SI;NO;NO;SI;SI;SI;NO;NO;NO;;;
77;722;LA LIBERTAD;TRUJILLO;TRUJILLO;;;;ORA HOSPITAL VÍCTOR LAZARTE ECHEGARAY (ESSALUD);08:45 a 13:00 - 14:00 a 16:30 ;Avenida Prolongación Unión 1375;OPERATIVO;SI;NO;NO;SI;SI;SI;NO;NO;NO;;;
78;319;CAJAMARCA;CONTUMAZA;CHILETE;;;;PANP CHILETE;08:45 a 13:00 - 14:00 a 16:45 ;Jr. Arequipa N° 330;DESPLAZAMIENTO;NO;NO;SI;SI;SI;NO;NO;NO;NO;;;
79;;LA LIBERTAD;JULCAN;JULCAN;;;;PAP JULCAN;08:45 a 13:00 - 14:00 a 16:46;Avenida 28 de Julio N° 201, Centro Cívico;OPERATIVO;NO;NO;SI;SI;SI;NO;NO;NO;NO;;;
80;;LA LIBERTAD;TRUJILLO;TRUJILLO;;;;AGENTE RENIEC - OR TRUJILLO;08:45 a 16:45;Avenida Pablo Casals Mz. A Lt. 6 Urb. Los Cedros;OPERATIVO;NO;NO;SI;NO;NO;NO;SI;NO;NO;;;
81;109;SAN MARTIN;SAN MARTIN;TARAPOTO;;;;ORA HOSPITAL TARAPOTO (MINSA);08:45 a 16:30;Jirón Angel Delgado Morey Nº 503;OPERATIVO;NO;NO;NO;SI;SI;SI;NO;NO;NO;;;
82;120;LORETO;DATEM DEL MARAÑON;BARRANCA;;;;PAP DATEM DEL MARAÑON;08:45 a 16:45;Calle Tigre Mz. 31 Lt. 08 - San Lorenzo;OPERATIVO;SI;NO;SI;SI;SI;NO;SI;SI;NO;;;
83;331;SAN MARTIN;RIOJA;NUEVA CAJAMARCA;;;;AG NUEVA CAJAMARCA;08:45 a 16:45;Carretera Fernando Belaunde Terry Altura del Km. 447.50 ;OPERATIVO;SI;NO;SI;SI;SI;NO;SI;SI;NO;;;
84;432;LORETO;ALTO AMAZONAS;YURIMAGUAS;;;;AG ALTO AMAZONAS;08:45 a 16:45;Calle Mariscal Castilla N° 411;OPERATIVO;SI;SI;SI;SI;SI;NO;SI;SI;SI;;;
85;543;SAN MARTIN;MOYOBAMBA ;MOYOBAMBA;;;;ORA HOSPITAL MOYOBAMBA (MINSA);08:45 a 16:30;Jirón Grau cuadra 4;OPERATIVO;SI;NO;NO;SI;SI;SI;NO;NO;NO;;;
86;581;SAN MARTIN;MOYOBAMBA ;MOYOBAMBA;;;;AG MOYOBAMBA;08:45 a 16:45;Jirón Dos de Mayo Mz. 1530 Lt. 14 (837);OPERATIVO;SI;SI;SI;SI;SI;NO;SI;SI;SI;;;
87;582;SAN MARTIN;HUALLAGA;SAPOSOA;;;;AG HUALLAGA;08:45 a 16:45;Jirón Lima N° 591;OPERATIVO;SI;NO;SI;SI;SI;NO;SI;SI;NO;;;
88;583;SAN MARTIN;LAMAS;LAMAS;;;;AG LAMAS;08:45 a 16:45;Jirón San Martín N° 984;OPERATIVO;SI;SI;SI;SI;SI;NO;SI;SI;SI;;;
89;584;SAN MARTIN;MARISCAL CACERES;JUANJUI;;;;AG MARISCAL CACERES;08:45 a 16:45;Jirón Eduardo Peña Meza N° 772 ;OPERATIVO;SI;SI;SI;SI;SI;NO;SI;SI;SI;;;
90;585;SAN MARTIN;RIOJA;RIOJA;;;;OR RIOJA;08:45 a 16:45;Jirón Angaiza N° 530;OPERATIVO;SI;SI;SI;SI;SI;SI;SI;SI;SI;;;
91;586;SAN MARTIN;SAN MARTIN ;TARAPOTO;;;;OR TARAPOTO;08:45 a 16:45;Jirón Jiménez Pimentel N° 280 ;OPERATIVO;SI;SI;SI;SI;SI;SI;SI;SI;SI;;;
92;587;SAN MARTIN;BELLAVISTA;BELLAVISTA;;;;AG BELLAVISTA;08:45 a 16:45;Jirón Huallaga - Iquitos Mz. 7 Lt. 27 - A.  1er. Piso;OPERATIVO;SI;SI;SI;SI;SI;NO;SI;SI;SI;;;
93;589;SAN MARTIN;PICOTA;PICOTA;;;;AG PICOTA;08:45 a 16:45;Jirón Simón Bolívar, cuadra 4;OPERATIVO;SI;NO;SI;SI;SI;NO;SI;SI;NO;;;
94;590;SAN MARTIN;EL DORADO ;SAN JOSE DE SISA;;;;AG EL DORADO;08:45 a 16:45;Jirón Comercio N° 610;OPERATIVO;NO;NO;SI;SI;SI;NO;NO;NO;NO;;;
95;601;LORETO;DATEM DEL MARAÑON;BARRANCA;;;;ORA SAN LORENZO - NUCLEO BASE (MINSA);08:45 a 16:30;Barrio Daniel Alcides Carrión S/N - Barrio Huacachina;OPERATIVO;SI;NO;NO;SI;SI;SI;NO;NO;NO;;;
96;612;SAN MARTIN;SAN MARTIN ;LA BANDA DE SHILCAYO;;;;AG LA BANDA DE SHILCAYO;08:45 a 16:45;Jirón Yurimaguas N° 340;OPERATIVO;SI;SI;SI;SI;SI;NO;SI;SI;SI;;;
97;632;SAN MARTIN;MARISCAL CACERES;JUANJUI;;;;ORA HOSPITAL JUANJUI (MINSA);08:45 a 16:30;Jirón Arica N° 205;OPERATIVO;SI;NO;NO;SI;SI;SI;NO;NO;NO;;;
98;658;SAN MARTIN;RIOJA;RIOJA;;;;ORA HOSPITAL DE RIOJA (MINSA);08:45 a 16:30;Jirón Túpac Amaru S/N;OPERATIVO;SI;NO;NO;SI;SI;SI;NO;NO;NO;;;
99;509;LORETO;ALTO AMAZONAS;LAGUNAS;;;;AG LAGUNAS;08:45 a 16:45;Jirón FITZCARRALD C-9;OPERATIVO;SI;NO;SI;SI;SI;NO;NO;NO;NO;;;
100;983;SAN MARTIN;SAN MARTIN;MORALES;;;;PANP MORALES;08:45 a 16:45;Jirón Tarapoto N° 116 Plaza de Armas;OPERATIVO;SI;NO;SI;SI;SI;NO;SI;SI;NO;;;
101;603;LORETO;ALTO AMAZONAS;YURIMAGUAS;;;;ORA HOSPITAL SANTA GEMA YURIMAGUAS (MINSA);08:45 a 16:30;CALLE HUALLAGA  C-4;OPERATIVO;SI;NO;NO;SI;SI;SI;NO;NO;NO;;;
102;55;LORETO;MAYNAS;PUNCHANA;;;;"ORA HOSPITAL REGIONAL DE LORETO ""FELIPE ARRIOLA IGLESIAS""";08:45 a 16:30;Avenida 28 de Julio S/N;OPERATIVO;SI;NO;NO;SI;SI;SI;NO;NO;NO;;;
103;85;LORETO;MAYNAS;IQUITOS;;;;"ORA HOSPITAL IQUITOS ""CESAR GARAYAR GARCIA""";08:45 a 16:30;Calle Cornejo Portugal 1710;OPERATIVO;SI;NO;NO;SI;SI;SI;NO;NO;NO;;;
104;332;LORETO;MAYNAS;BELÉN;;;;OR BELEN;08:45 a 16:45;Calle Miraflores S/N P. J. 09 de Octubre;OPERATIVO;SI;NO;SI;SI;SI;SI;SI;SI;NO;;;
105;431;LORETO;MAYNAS;IQUITOS;;;;OR IQUITOS;08:45 a 16:45;Jirón Próspero Nº 201;OPERATIVO;SI;SI;SI;SI;SI;SI;SI;SI;SI;;;
106;433;LORETO;LORETO;NAUTA;;;;PAP NAUTA;08:45 a 16:45;Cal. Manuel Pacaya N° 570 centro cívico;OPERATIVO;SI;NO ;SI;SI;SI;NO;SI;SI;NO;;;
107;434;LORETO;REQUENA;REQUENA;;;;PAP REQUENA;08:45 a 16:45;Calle San Antonio S/N Anexo Hotel Municipal;OPERATIVO;SI;NO ;SI;SI;SI;NO;SI;SI;NO;;;
108;436;LORETO;MARISCAL RAMON CASTILLA;RAMON CASTILLA;;;;PAP MARISCAL RAMON CASTILLA - CABALLOCOCHA;08:45 a 16:45;Calle Ayacucho Mz. 22 Lt. 4 C con Amazonas S/N - Local Municipal;OPERATIVO;SI;NO ;SI;SI;SI;NO;SI;SI;NO;;;
109;438;LORETO;MAYNAS;SAN JUAN BAUTISTA;;;;OR SAN JUAN BAUTISTA;08:45 a 16:45;Avenida Abelardo Quiñones Nº 2371 Km. 2.5 ;OPERATIVO;SI;NO ;SI;SI;SI;SI;SI;SI;NO;;;
110;439;LORETO;MARISCAL RAMON CASTILLA;YAVARI;;;;PAP YAVARI;08:45 a 16:45;Calle Nueva Jerusalen S/N Local Municipal;OPERATIVO;NO;NO ;SI;SI;SI;NO;NO;NO;NO;;;
111;440;LORETO;PUTUMAYO;PUTUMAYO;;;;PAP PUTUMAYO;08:45 a 16:45;Calle Arequipa S/N;OPERATIVO;NO;NO ;SI;SI;SI;NO;NO;NO;NO;;;
112;449;LORETO;MAYNAS;PUNCHANA;;;;PAP PUNCHANA;08:45 a 16:45;Calle Cusco S/N, cuadra 5, esquina con Trujillo.;OPERATIVO;SI;NO ;SI;SI;SI;NO;SI;NO;NO;;;
113;645;LORETO;REQUENA;REQUENA;;;;ORA REQUENA;08:45 a 16:30;Calle Mártires del Petroléo S/N - Malecon Grau;OPERATIVO;SI;NO ;NO;SI;SI;SI;NO;NO;NO;;;
114;711;LORETO;MARISCAL RAMON CASTILLA;RAMON CASTILLA;;;;ORA CABALLOCOCHA;08:45 a 16:30;Calle Progreso N° 425;OPERATIVO;si;NO ;NO;SI;SI;SI;NO;NO;NO;;;
115;806;LORETO;MAYNAS;PUNCHANA;;;;MAC - LORETO;08:30 a 16:30;Avenida La Marina Nº  1338;OPERATIVO;SI;NO ;SI;SI;SI;NO;SI;SI;NO;;;
116;600019;LORETO;MAYNAS;IQUITOS;;;;AGENTE RENIEC - OR IQUITOS;08:45 a 16:45;Jirón Próspero Nº 201;OPERATIVO;NO;NO;SI;NO;NO;NO;SI;NO;NO;;;
117;339;LORETO;PUTUMAYO;TENIENTE MANUEL CLAVERO;;;;PANP SOPLIN VARGAS;08:45 a 16:45;Plaza de armas S/N;OPERATIVO;NO;NO ;SI;SI;SI;NO;NO;NO;NO;;;
118;33;ANCASH;SANTA;CHIMBOTE;;;;OR SANTA;08:45 a 16:45;Jirón Enrique Palacios Nº 504-506 esquina con Jr. Ladislao Espinar Nº 401;OPERATIVO;SI;SI;SI;SI;SI;SI;SI;SI;SI;;;
119;;ANCASH;SANTA;CHIMBOTE;;;;AGENTE RENIEC - MEGA PLAZA CHIMBOTE;08:45 a 16:45; Mz. B Lt. 1-A-1-A2 Sector Parque Gran Chavín, Centro Comercial Megaplaza Chimbote;OPERATIVO;NO;NO;NO;NO;NO;NO;SI;SI;NO;;;
120;1182;ANCASH;SANTA;CHIMBOTE;;;;MAC - ANCASH;08:30 a 16:30; Mz. B Lt. 1-A-1-A2 Sector Parque Gran Chavín, Centro Comercial Megaplaza Chimbote;OPERATIVO;SI;SI;SI;SI;SI;NO;SI;SI;SI;;;
121;137;ANCASH;SANTA;NUEVO CHIMBOTE;;;;AG NUEVO CHIMBOTE;08:45 a 16:45; Mz. 74-75 Lt. 1 del Centro Cívico de la Municipalidad Distrital de Nuevo Chimbote;OPERATIVO;SI;SI;SI;SI;SI;NO;SI;SI;SI;;;
122;21;ANCASH;HUARAZ;HUARAZ;;;;AG HUARAZ;08:45 a 16:45;Jirón Agustin Loly N° 756, Mz. 29A Lt. 27, Barrio La Soledad Alta, intersección con Jr. Agustin Mejía;OPERATIVO;SI;SI;SI;SI;SI;NO;SI;SI;SI;;;
123;27;ANCASH;HUAYLAS;CARAZ;;;;AG HUAYLAS;08:45 a 16:45;Jirón Raimondi N° 215;OPERATIVO;SI;SI;SI;SI;SI;NO;SI;SI;SI;;;
124;28;ANCASH;HUARI;HUARI;;;;AG HUARI;08:45 a 16:45;Jirón Libertad Mz. P2 Lt. 003;OPERATIVO;SI;SI;SI;SI;SI;NO;SI;SI;SI;;;
125;31;ANCASH;POMABAMBA;POMABAMBA;;;;AG POMABAMBA;08:45 a 16:45;Jirón Huaraz Nº 369;OPERATIVO;SI;SI;SI;SI;SI;NO;SI;SI;SI;;;
126;34;ANCASH;SIHUAS;SIHUAS;;;;AG SIHUAS;08:45 a 16:45;Jirón Gomes Arias 106, Barrio Pingullo Alto;OPERATIVO;SI;SI;SI;SI;SI;NO;SI;SI;SI;;;
127;518;ANCASH;PALLASCA;PAMPAS;;;;AG PAMPAS;08:45 a 16:45;Calle Plaza de Armas S/N - Municipalidad Distrital de Pampas - 1er piso;OPERATIVO;SI;SI;SI;SI;SI;NO;SI;SI;NO;;;
128;25;ANCASH;CASMA;CASMA;;;;PAP CASMA;08:45 a 16:45; Sector Hijuela Mz. C Lt. 13 del Centro Cívico de la Municipalidad Provincial de Casma;OPERATIVO;SI;SI;SI;SI;SI;NO;SI;SI;NO;;;
129;39;ANCASH;HUARMEY;HUARMEY;;;;PAP HUARMEY;08:45 a 16:45; 1er. Pabellón S/N del Centro Cívico de la Municipalidad Provincial de Huarmey;OPERATIVO;SI;SI;SI;SI;SI;NO;SI;SI;NO;;;
130;32;ANCASH;RECUAY;RECUAY;;;;PAP RECUAY;08:45 a 16:45;Calle Plaza de Armas Nº 180 Municipalidad Distrital de Recuay;OPERATIVO;SI;NO;SI;SI;SI;NO;SI;SI;NO;;;
131;24;ANCASH;CARHUAZ;CARHUAZ;;;;PAP CARHUAZ;08:45 a 16:45;Avenida La Merced Nº 1006;OPERATIVO;SI;SI;SI;SI;SI;NO;NO;NO;NO;;;
132;35;ANCASH;YUNGAY;YUNGAY;;;;PAP YUNGAY;08:45 a 16:45;Avenida Arias Grazziani Lt. 1-2 Centro Cívico de la Municipalidad Provincial de Yungay;OPERATIVO;SI;NO;SI;SI;SI;NO;NO;NO;NO;;;
133;37;ANCASH;CARLOS FERMIN FITZCARRALD;SAN LUIS;;;;PAP CARLOS FERMÍN FITZCARRALD;08:45 a 16:45;Avenida Ramón Castilla N° 320 - 1er. piso Centro Cívico de la Municipalidad Provincial de C. F. Fitzcarrald;OPERATIVO;SI;SI;SI;SI;SI;NO;SI;SI;NO;;;
134;29;ANCASH;MARISCAL LUZURIAGA;PISCOBAMBA;;;;PAP MARISCAL LUZURIAGA;08:45 a 16:45;Jirón San Pablo S/N, Centro Cívico de la Municipalidad Provincial de Mariscal Luzuriaga;OPERATIVO;SI;NO;SI;SI;SI;NO;SI;SI;NO;;;
135;140;ANCASH;SANTA;CHIMBOTE;;;;ORA HOSPITAL LA CALETA (Chimbote);08:45 a 16:30;Avenida Malecon Grau S/N;OPERATIVO;SI;SI;NO;SI;SI;SI;NO;NO;NO;;;
136;57;ANCASH;SANTA;CHIMBOTE;;;;ORA HOSPITAL ESSALUD III CHIMBOTE;08:45 a 16:30;Avenida Circunvalación Nº 119 Urb. Laderas del Norte;OPERATIVO;SI;SI;NO;SI;SI;SI;NO;NO;NO;;;
137;56;ANCASH;SANTA;NUEVO CHIMBOTE;;;;ORA HOSPITAL ELEAZAR GUZMÁN BARRÓN (Nuevo Chimbote);08:45 a 16:30;Avenida Brasil S/N, Urb. Santa Cristina (Hospital Regional Eleazar Guzmán Barrón puerta de Emergencia);OPERATIVO;SI;SI;NO;SI;SI;SI;NO;NO;NO;;;
138;295;ANCASH;HUARAZ;HUARAZ;;;;ORA HOSPITAL VÍCTOR RAMOS GUARDIA (Huaraz);08:45 a 16:30;Avenida Mariscal Luzuriaga cdra. 01, cruce con Jr. Pedro Villón cdra. 10;OPERATIVO;SI;SI;NO;SI;SI;SI;NO;NO;NO;;;
139;595;ANCASH;HUAYLAS;CARAZ;;;;ORA HOSPITAL DE APOYO CARAZ;08:45 a 16:30;Avenida 9 de Octubre S/N;OPERATIVO;SI;SI;NO;SI;SI;SI;NO;NO;NO;;;
140;748;ANCASH;HUARI;HUARI;;;;ORA HOSPITAL DE APOYO HUARI;08:45 a 16:30;Avenida Circunvalación Baja S/N;OPERATIVO;SI;SI;NO;SI;SI;SI;NO;NO;NO;;;
141;26;ANCASH;CORONGO;CORONGO;;;;PANP CORONGO;08:45 a 16:45;Jirón Grau N° 206, primer piso de la Municipalidad Provincial de Corongo;DESPLAZAMIENTO;NO;NO;SI;SI;SI;NO;NO;NO;NO;;;
142;30;ANCASH;PALLASCA;CABANA;;;;PANP PALLASCA;08:45 a 16:45;Avenida Plaza de Armas N° 103, primer piso de la Municipalidad Provincial de Pallasca;DESPLAZAMIENTO;NO;NO;SI;SI;SI;NO;NO;NO;NO;;;
143;22;ANCASH;AIJA;AIJA;;;;PANP AIJA;08:45 a 16:45;Jirón Gavino Uribe S/N Plaza de Armas, 1er piso de la Municipalidad Provincial de Aija;DESPLAZAMIENTO;NO;NO;SI;SI;SI;NO;NO;NO;NO;;;
144;23;ANCASH;BOLOGNESI;CHIQUIAN;;;;PANP BOLOGNESI;08:45 a 16:45;Jirón Tacna 320, primer piso del Centro Cívico de la Municipalidad Distrital de Chiquian;DESPLAZAMIENTO;NO;NO;SI;SI;SI;NO;NO;NO;NO;;;
145;741;ANCASH;YUNGAY;YANAMA;;;;AG YANAMA;08:45 a 16:45;Jirón Yungay S/N cdra. 03;DESPLAZAMIENTO;NO;NO;SI;SI;SI;NO;NO;NO;NO;;;
146;470;ANCASH;MARISCAL LUZURIAGA;LLUMPA;;;;PANP LLUMPA;08:45 a 16:45; Plaza de Armas S/N;DESPLAZAMIENTO;NO;NO;SI;SI;SI;NO;NO;NO;NO;;;
147;38;ANCASH;ASUNCION;CHACAS;;;;PANP ASUNCIÓN;08:45 a 16:45;Jirón Coliseo de Chacas S/N;DESPLAZAMIENTO;NO;NO;SI;SI;SI;NO;NO;NO;NO;;;
148;714;ANCASH;HUARI;CHAVIN DE HUANTAR;;;;PANP CHAVÍN DE HUANTAR;08:45 a 16:45;Jirón San Martin S/N, 1er piso del Centro Cívico de la Municipalidad Distrital de Chavin de Huantar;DESPLAZAMIENTO;NO;NO;SI;SI;SI;NO;NO;NO;NO;;;
149;715;ANCASH;HUARI;SAN MARCOS;;;;PANP SAN MARCOS ;08:45 a 16:45;Jirón Progreso 332, Plaza de Armas de San Marcos;DESPLAZAMIENTO;NO;NO;SI;SI;SI;NO;NO;NO;NO;;;
150;249;ANCASH;HUACAYBAMBA;HUACAYBAMBA;;;;PANP HUACAYBAMBA;08:45 a 16:45;Avenida El Ejercito S/N Barrio San Pedro, 1er piso Municipalidad Provincial de Huacaybamba;DESPLAZAMIENTO;NO;NO;SI;SI;SI;NO;NO;NO;NO;;;
151;36;ANCASH;ANTONIO RAIMONDI;LLAMELLIN;;;;PANP ANTONIO RAIMONDI;08:45 a 16:45;Jirón Simón Bolívar N° 229;DESPLAZAMIENTO;NO;NO;SI;SI;SI;NO;NO;NO;NO;;;
152;766;ANCASH;HUARI;UCO;;;;PANP UCO;08:45 a 16:45;Jirón Nicolas de Piérola S/N Plaza de Armas, 1er piso de la Municipalidad Distrital de Uco;DESPLAZAMIENTO;NO;NO;SI;SI;SI;NO;NO;NO;NO;;;
153;281;JUNIN;HUANCAYO;EL TAMBO;;;;OR HUANCAYO;08:45 a 16:45;AVENIDA MARISCAL CASTILLA Nº 1801;OPERATIVO;SI;SI;SI;SI;SI;NO;SI;SI;SI;;;
154;285;JUNIN;TARMA;TARMA;;;;AG TARMA;08:45 a 16:45;JIRÓN AREQUIPA Nº 939;OPERATIVO;SI;SI;SI;SI;SI;NO;SI;SI;SI;;;
155;288;JUNIN;CHANCHAMAYO;LA MERCED;;;;AG CHANCHAMAYO;08:45 a 16:45;PROLONGACIÓN TARMA Nº 242;OPERATIVO;SI;SI;SI;SI;SI;NO;SI;SI;SI;;;
156;146;JUNIN;SATIPO;PANGOA;;;;PAP PANGOA;08:45 a 16:45;CALLE 07 DE JUNIO Nº 641 PLAZA PRINCIPAL CENTRO CIVICO;OPERATIVO;SI;SI;SI;SI;SI;NO;SI;SI;SI;;;
157;279;JUNIN;SATIPO;MAZAMARI;;;;PAP MAZAMARI;08:45 a 16:45;AVENIDA SAN JUAN N° 377;OPERATIVO;NO;NO;SI;SI;SI;NO;SI;SI;NO;;;
158;282;JUNIN;CONCEPCION;CONCEPCIÓN;;;;PAP CONCEPCIÓN;08:45 a 16:45;JIRÓN RICARDO PALMA S/N MERCADO MODELO INTERIOR 1 ;OPERATIVO;SI;SI;SI;SI;SI;NO;SI;SI;SI;;;
